cve_id,software_name,affected_versions,vulnerability_type,attack_vector,cvss_score,severity,published_date,cwe_ids,description,cleaned_description
CVE-1999-1591,Microsoft,"4.0 SP4, 6.0.",Authentication Bypass,Remote,7.5,HIGH,1999-12-31T05:00:00.000,Unknown,"Microsoft Internet Information Services (IIS) server 4.0 SP4, without certain hotfixes released for SP4, does not require authentication credentials under certain conditions, which allows remote attackers to bypass authentication requirements, as demonstrated by connecting via Microsoft Visual InterDev 6.0.","Microsoft Internet Information Services (IIS) server 4.0 SP4, without certain hotfixes released for SP4, does not require authentication credentials under certain conditions, which allows remote attackers to bypass authentication requirements, as demonstrated by connecting via Microsoft Visual InterDev 6.0."
CVE-2000-0120,Allaire Spectra,1.0 allows,Authentication Bypass,Remote,7.5,HIGH,2000-01-01T05:00:00.000,Unknown,The Remote Access Service invoke.cfm template in Allaire Spectra 1.0 allows users to bypass authentication via the bAuthenticated parameter.,The Remote Access Service invoke.cfm template in Allaire Spectra 1.0 allows users to bypass authentication via the bAuthenticated parameter.
CVE-2000-0148,MySQL,3.22 allows,,Remote,7.5,HIGH,2000-02-08T05:00:00.000,Unknown,MySQL 3.22 allows remote attackers to bypass password authentication and access a database via a short check string.,MySQL 3.22 allows remote attackers to bypass password authentication and access a database via a short check string.
CVE-2000-0233,Linux,,,Remote,10.0,CRITICAL,2000-03-15T05:00:00.000,Unknown,SuSE Linux IMAP server allows remote attackers to bypass IMAP authentication and gain privileges.,SuSE Linux IMAP server allows remote attackers to bypass IMAP authentication and gain privileges.
CVE-2000-0350,NetworkICE ICEcap,2.0.23 and,,Remote,5.0,MEDIUM,2000-05-17T04:00:00.000,Unknown,"A debugging feature in NetworkICE ICEcap 2.0.23 and earlier is enabled, which allows a remote attacker to bypass the weak authentication and post unencrypted events.","A debugging feature in NetworkICE ICEcap 2.0.23 and earlier is enabled, which allows a remote attacker to bypass the weak authentication and post unencrypted events."
CVE-2000-0610,,2.6g,Authentication Bypass,Remote,5.0,MEDIUM,2000-06-23T04:00:00.000,Unknown,NetWin dMailWeb and cwMail 2.6g and earlier allows remote attackers to bypass authentication and use the server for mail relay via a username that contains a carriage return.,NetWin dMailWeb and cwMail 2.6g and earlier allows remote attackers to bypass authentication and use the server for mail relay via a username that contains a carriage return.
CVE-2000-0611,,,Denial of Service,Unknown,5.0,MEDIUM,2000-06-23T04:00:00.000,Unknown,"The default configuration of NetWin dMailWeb and cwMail trusts all POP servers, which allows attackers to bypass normal authentication and cause a denial of service.","The default configuration of NetWin dMailWeb and cwMail trusts all POP servers, which allows attackers to bypass normal authentication and cause a denial of service."
CVE-1999-1177,,1.2 allows,Path Traversal,Remote,5.0,MEDIUM,1999-12-31T05:00:00.000,Unknown,Directory traversal vulnerability in nph-publish before 1.2 allows remote attackers to overwrite arbitrary files via a .. (dot dot) in the pathname for an upload operation.,Directory traversal vulnerability in nph-publish before 1.2 allows remote attackers to overwrite arbitrary files via a .. (dot dot) in the pathname for an upload operation.
CVE-2001-0205,AOLserver,3.2 and,Path Traversal,Remote,5.0,MEDIUM,2001-05-03T04:00:00.000,Unknown,"Directory traversal vulnerability in AOLserver 3.2 and earlier allows remote attackers to read arbitrary files by inserting ""..."" into the requested pathname, a modified .. (dot dot) attack.","Directory traversal vulnerability in AOLserver 3.2 and earlier allows remote attackers to read arbitrary files by inserting ""..."" into the requested pathname, a modified .. (dot dot) attack."
CVE-2001-0206,Soft Lite ServerWorx,3.00 allows,Path Traversal,Remote,5.0,MEDIUM,2001-06-02T04:00:00.000,Unknown,Directory traversal vulnerability in Soft Lite ServerWorx 3.00 allows remote attackers to read arbitrary files by inserting a .. (dot dot) or ... into the requested pathname of an HTTP GET request.,Directory traversal vulnerability in Soft Lite ServerWorx 3.00 allows remote attackers to read arbitrary files by inserting a .. (dot dot) or ... into the requested pathname of an HTTP GET request.
CVE-2002-0244,AtheOS,0.3.7 allows,Path Traversal,Unknown,7.5,HIGH,2002-05-29T04:00:00.000,Unknown,Directory traversal vulnerability in chroot function in AtheOS 0.3.7 allows attackers to escape the jail via a .. (dot dot) in the pathname argument to chdir.,Directory traversal vulnerability in chroot function in AtheOS 0.3.7 allows attackers to escape the jail via a .. (dot dot) in the pathname argument to chdir.
CVE-2002-1525,Starter Kit,2.0 allows,Path Traversal,Remote,5.0,MEDIUM,2003-04-02T05:00:00.000,Unknown,"Directory traversal vulnerability in ASTAware SearchDisk engine for Sun ONE Starter Kit 2.0 allows remote attackers to read arbitrary files via a .. (dot dot) attack on port (1) 6015 or (2) 6016, or (3) an absolute pathname to port 6017.","Directory traversal vulnerability in ASTAware SearchDisk engine for Sun ONE Starter Kit 2.0 allows remote attackers to read arbitrary files via a .. (dot dot) attack on port (1) 6015 or (2) 6016, or (3) an absolute pathname to port 6017."
CVE-2003-1345,Plus,5.00 allows,Path Traversal,Remote,5.0,MEDIUM,2003-12-31T05:00:00.000,CWE-22,Directory traversal vulnerability in s.dll in WebCollection Plus 5.00 allows remote attackers to view arbitrary files in c:\ via a full pathname in the d parameter.,Directory traversal vulnerability in s.dll in WebCollection Plus 5.00 allows remote attackers to view arbitrary files in c:\ via a full pathname in the d parameter.
CVE-2003-1463,Alt,"2.0.0 through, 2.0.2 allows",Path Traversal,Remote,3.5,LOW,2003-12-31T05:00:00.000,CWE-20,"Absolute path traversal vulnerability in Alt-N Technologies WebAdmin 2.0.0 through 2.0.2 allows remote attackers with administrator privileges to (1) determine the installation path by reading the contents of the Name parameter in a link, and (2) read arbitrary files via an absolute path in the Name parameter.","Absolute path traversal vulnerability in Alt-N Technologies WebAdmin 2.0.0 through 2.0.2 allows remote attackers with administrator privileges to (1) determine the installation path by reading the contents of the Name parameter in a link, and (2) read arbitrary files via an absolute path in the Name parameter."
CVE-2003-1545,Nuke,6.5,Path Traversal,Remote,5.0,MEDIUM,2003-12-31T05:00:00.000,CWE-22,"Absolute path traversal vulnerability in nukestyles.com viewpage.php addon for PHP-Nuke allows remote attackers to read arbitrary files via a full pathname in the file parameter.  NOTE: This was originally reported as an issue in PHP-Nuke 6.5, but this is an independent addon.","Absolute path traversal vulnerability in nukestyles.com viewpage.php addon for PHP-Nuke allows remote attackers to read arbitrary files via a full pathname in the file parameter. NOTE: This was originally reported as an issue in PHP-Nuke 6.5, but this is an independent addon."
CVE-2004-2047,EasyWeb FileManager,1.0 RC,Path Traversal,Remote,5.0,MEDIUM,2004-07-23T04:00:00.000,Unknown,Directory traversal vulnerability in EasyWeb FileManager 1.0 RC-1 for PostNuke allows remote attackers to retrieve arbitrary files via a .. (dot dot) in the pathext parameter.,Directory traversal vulnerability in EasyWeb FileManager 1.0 RC-1 for PostNuke allows remote attackers to retrieve arbitrary files via a .. (dot dot) in the pathext parameter.
CVE-2004-0235,LHA,1.14 allow,Path Traversal,Remote,6.4,MEDIUM,2004-08-18T04:00:00.000,Unknown,"Multiple directory traversal vulnerabilities in LHA 1.14 allow remote attackers or local users to create arbitrary files via an LHA archive containing filenames with (1) .. sequences or (2) absolute pathnames with double leading slashes (""//absolute/path"").","Multiple directory traversal vulnerabilities in LHA 1.14 allow remote attackers or local users to create arbitrary files via an LHA archive containing filenames with (1) .. sequences or (2) absolute pathnames with double leading slashes (""//absolute/path"")."
CVE-2002-0645,Microsoft,,SQL Injection,Unknown,7.5,HIGH,2002-08-12T04:00:00.000,Unknown,SQL injection vulnerability in stored procedures for Microsoft SQL Server 2000 and Microsoft Desktop Engine (MSDE) 2000 may allow authenticated users to execute arbitrary commands.,SQL injection vulnerability in stored procedures for Microsoft SQL Server 2000 and Microsoft Desktop Engine (MSDE) 2000 may allow authenticated users to execute arbitrary commands.
CVE-2002-0719,Microsoft,,SQL Injection,Remote,7.5,HIGH,2002-08-12T04:00:00.000,Unknown,SQL injection vulnerability in the function that services for Microsoft Content Management Server (MCMS) 2001 allows remote attackers to execute arbitrary commands via an MCMS resource request for image files or other files.,SQL injection vulnerability in the function that services for Microsoft Content Management Server (MCMS) 2001 allows remote attackers to execute arbitrary commands via an MCMS resource request for image files or other files.
CVE-2002-0985,PHP,4.2.2 may,,Unknown,7.5,HIGH,2002-09-24T04:00:00.000,CWE-88,"Argument injection vulnerability in the mail function for PHP 4.x to 4.2.2 may allow attackers to bypass safe mode restrictions and modify command line arguments to the MTA (e.g. sendmail) in the 5th argument to mail(), altering MTA behavior and possibly executing commands.","Argument injection vulnerability in the mail function for PHP 4.x to 4.2.2 may allow attackers to bypass safe mode restrictions and modify command line arguments to the MTA (e.g. sendmail) in the 5th argument to mail(), altering MTA behavior and possibly executing commands."
CVE-2002-1760,PHProjekt,"2.0 through, 3.1 allow",SQL Injection,Remote,7.5,HIGH,2002-12-31T05:00:00.000,Unknown,Multiple SQL injection vulnerabilities in PHProjekt 2.0 through 3.1 allow remote attackers to execute arbitrary SQL commands via the unknown attack vectors.,Multiple SQL injection vulnerabilities in PHProjekt 2.0 through 3.1 allow remote attackers to execute arbitrary SQL commands via the unknown attack vectors.
CVE-2002-1879,LokwaBB,1.2.2 allows,SQL Injection,Remote,7.5,HIGH,2002-12-31T05:00:00.000,Unknown,SQL injection vulnerability in LokwaBB 1.2.2 allows remote attackers to execute arbitrary SQL commands via the (1) member parameter to member.php or (2) loser parameter to misc.php.,SQL injection vulnerability in LokwaBB 1.2.2 allows remote attackers to execute arbitrary SQL commands via the (1) member parameter to member.php or (2) loser parameter to misc.php.
CVE-2002-1919,VP,4.0 allows,SQL Injection,Remote,7.5,HIGH,2002-12-31T05:00:00.000,Unknown,SQL injection vulnerability in shopadmin.asp in VP-ASP 4.0 allows remote attackers to execute arbitrary SQL commands and bypass authentication via the (1) username or (2) password fields.,SQL injection vulnerability in shopadmin.asp in VP-ASP 4.0 allows remote attackers to execute arbitrary SQL commands and bypass authentication via the (1) username or (2) password fields.
CVE-2002-2035,RealityScape MyLogin,1.0.0 and,SQL Injection,Remote,7.5,HIGH,2002-12-31T05:00:00.000,Unknown,SQL injection vulnerability in RealityScape MyLogin 2000 1.0.0 and earlier allows remote attackers to execute arbitrary SQL commands via the (1) Username or (2) Password in the login form.,SQL injection vulnerability in RealityScape MyLogin 2000 1.0.0 and earlier allows remote attackers to execute arbitrary SQL commands via the (1) Username or (2) Password in the login form.
CVE-2005-1306,Acrobat,"7.0 and, 7.0.1 allows",XML External Entity,Remote,7.5,HIGH,2005-06-15T04:00:00.000,CWE-611,"The Adobe Reader control in Adobe Reader and Acrobat 7.0 and 7.0.1 allows remote attackers to determine the existence of files via Javascript containing XML script, aka the ""XML External Entity vulnerability.""","The Adobe Reader control in Adobe Reader and Acrobat 7.0 and 7.0.1 allows remote attackers to determine the existence of files via Javascript containing XML script, aka the ""XML External Entity vulnerability."""
CVE-2008-0628,Sun Java Runtime Environment JDK,,Remote Code Execution,Remote,7.8,HIGH,2008-02-06T21:00:00.000,CWE-264,"The XML parsing code in Sun Java Runtime Environment JDK and JRE 6 Update 3 and earlier processes external entity references even when the ""external general entities"" property is false, which allows remote attackers to conduct XML external entity (XXE) attacks and cause a denial of service or access restricted resources.","The XML parsing code in Sun Java Runtime Environment JDK and JRE 6 Update 3 and earlier processes external entity references even when the ""external general entities"" property is false, which allows remote attackers to conduct XML external entity (XXE) attacks and cause a denial of service or access restricted resources."
CVE-2009-1699,WebKit,"4.0, 1.0 through, 2.2.1, 1.1 through, 2.2.1 does",XML External Entity,Remote,7.5,HIGH,2009-06-10T18:00:00.517,CWE-611,"The XSL stylesheet implementation in WebKit in Apple Safari before 4.0, iPhone OS 1.0 through 2.2.1, and iPhone OS for iPod touch 1.1 through 2.2.1 does not properly handle XML external entities, which allows remote attackers to read arbitrary files via a crafted DTD, as demonstrated by a file:///etc/passwd URL in an entity declaration, related to an ""XXE attack.""","The XSL stylesheet implementation in WebKit in Apple Safari before 4.0, iPhone OS 1.0 through 2.2.1, and iPhone OS for iPod touch 1.1 through 2.2.1 does not properly handle XML external entities, which allows remote attackers to read arbitrary files via a crafted DTD, as demonstrated by a file:///etc/passwd URL in an entity declaration, related to an ""XXE attack."""
CVE-2009-3960,Data Services,"3.2 and, 8.0.1, 8.2.1, 9.0, 2.5.1, 2.6.1, 3.0, 2.0.1, 7.0.2, 8.0",Information Disclosure,Remote,6.5,MEDIUM,2010-02-15T18:30:00.407,Unknown,"Unspecified vulnerability in BlazeDS 3.2 and earlier, as used in LiveCycle 8.0.1, 8.2.1, and 9.0, LiveCycle Data Services 2.5.1, 2.6.1, and 3.0, Flex Data Services 2.0.1, and ColdFusion 7.0.2, 8.0, 8.0.1, and 9.0, allows remote attackers to obtain sensitive information via vectors that are associated with a request, and related to injected tags and external entity references in XML documents.","Unspecified vulnerability in BlazeDS 3.2 and earlier, as used in LiveCycle 8.0.1, 8.2.1, and 9.0, LiveCycle Data Services 2.5.1, 2.6.1, and 3.0, Flex Data Services 2.0.1, and ColdFusion 7.0.2, 8.0, 8.0.1, and 9.0, allows remote attackers to obtain sensitive information via vectors that are associated with a request, and related to injected tags and external entity references in XML documents."
CVE-2010-3322,Splunk,"4.0.0 through, 4.1.4 allows",XML External Entity,Remote,8.8,HIGH,2010-09-14T17:00:02.400,CWE-611,The XML parser in Splunk 4.0.0 through 4.1.4 allows remote authenticated users to obtain sensitive information and gain privileges via an XML External Entity (XXE) attack to unknown vectors.,The XML parser in Splunk 4.0.0 through 4.1.4 allows remote authenticated users to obtain sensitive information and gain privileges via an XML External Entity (XXE) attack to unknown vectors.
CVE-2011-1502,Apache,6.0.6 GA,XML External Entity,Remote,4.0,MEDIUM,2011-05-07T19:55:00.947,CWE-200,"Liferay Portal Community Edition (CE) 6.x before 6.0.6 GA, when Apache Tomcat is used, allows remote authenticated users to read arbitrary files via an entity declaration in conjunction with an entity reference, related to an XML External Entity (aka XXE) issue.","Liferay Portal Community Edition (CE) 6.x before 6.0.6 GA, when Apache Tomcat is used, allows remote authenticated users to read arbitrary files via an entity declaration in conjunction with an entity reference, related to an XML External Entity (aka XXE) issue."
CVE-2011-2206,DJabberd,0.85 allows,XML External Entity,Remote,5.5,MEDIUM,2011-06-22T22:55:04.230,CWE-399,"XMLParser.pm in DJabberd before 0.85 allows remote authenticated users to read arbitrary files, and possibly send HTTP requests to intranet servers or cause a denial of service (CPU and memory consumption), via an XML external entity declaration in conjunction with an entity reference, a different vulnerability than CVE-2011-1757.","XMLParser.pm in DJabberd before 0.85 allows remote authenticated users to read arbitrary files, and possibly send HTTP requests to intranet servers or cause a denial of service (CPU and memory consumption), via an XML external entity declaration in conjunction with an entity reference, a different vulnerability than CVE-2011-1757."
CVE-2011-0212,Apple Mac OS,10.6.8 allows,XML External Entity,Remote,6.4,MEDIUM,2011-06-24T20:55:02.590,CWE-399,"servermgrd in Apple Mac OS X before 10.6.8 allows remote attackers to read arbitrary files, and possibly send HTTP requests to intranet servers or cause a denial of service (CPU and memory consumption), via an XML-RPC request containing an entity declaration in conjunction with an entity reference, related to an XML External Entity (aka XXE) issue.","servermgrd in Apple Mac OS X before 10.6.8 allows remote attackers to read arbitrary files, and possibly send HTTP requests to intranet servers or cause a denial of service (CPU and memory consumption), via an XML-RPC request containing an entity declaration in conjunction with an entity reference, related to an XML External Entity (aka XXE) issue."
CVE-2011-3579,IceWarp WebMail,10.3.3 allows,XML External Entity,Remote,6.4,MEDIUM,2011-09-30T17:55:01.180,CWE-399,"server/webmail.php in IceWarp WebMail in IceWarp Mail Server before 10.3.3 allows remote attackers to read arbitrary files, and possibly send HTTP requests to intranet servers or cause a denial of service (CPU and memory consumption), via an XML external entity declaration in conjunction with an entity reference.","server/webmail.php in IceWarp WebMail in IceWarp Mail Server before 10.3.3 allows remote attackers to read arbitrary files, and possibly send HTTP requests to intranet servers or cause a denial of service (CPU and memory consumption), via an XML external entity declaration in conjunction with an entity reference."
CVE-2011-4107,PHP,"3.4.x, 3.4.7.1 and, 3.3.x, 3.3.10.5 allows",XML External Entity,Remote,6.5,MEDIUM,2011-11-17T19:55:01.517,CWE-611,"The simplexml_load_string function in the XML import plug-in (libraries/import/xml.php) in phpMyAdmin 3.4.x before 3.4.7.1 and 3.3.x before 3.3.10.5 allows remote authenticated users to read arbitrary files via XML data containing external entity references, aka an XML external entity (XXE) injection attack.","The simplexml_load_string function in the XML import plug-in (libraries/import/xml.php) in phpMyAdmin 3.4.x before 3.4.7.1 and 3.3.x before 3.3.10.5 allows remote authenticated users to read arbitrary files via XML data containing external entity references, aka an XML external entity (XXE) injection attack."
CVE-2018-0147,Java,5.8 patch,Command Injection,Remote,9.8,CRITICAL,2018-03-08T07:29:00.377,"CWE-20, CWE-502","A vulnerability in Java deserialization used by Cisco Secure Access Control System (ACS) prior to release 5.8 patch 9 could allow an unauthenticated, remote attacker to execute arbitrary commands on an affected device. The vulnerability is due to insecure deserialization of user-supplied content by the affected software. An attacker could exploit this vulnerability by sending a crafted serialized Java object. An exploit could allow the attacker to execute arbitrary commands on the device with root privileges. Cisco Bug IDs: CSCvh25988.","A vulnerability in Java deserialization used by Cisco Secure Access Control System (ACS) prior to release 5.8 patch 9 could allow an unauthenticated, remote attacker to execute arbitrary commands on an affected device. The vulnerability is due to insecure deserialization of user-supplied content by the affected software. An attacker could exploit this vulnerability by sending a crafted serialized Java object. An exploit could allow the attacker to execute arbitrary commands on the device with root privileges. Cisco Bug IDs: CSCvh25988."
CVE-2018-1000167,Remote Code Execution,"1.0.0a1, 1.0.0b1",Remote Code Execution,Remote,9.3,CRITICAL,2018-04-18T19:29:00.833,CWE-502,"OISF suricata-update version 1.0.0a1 contains an Insecure Deserialization vulnerability in the insecure yaml.load-Function as used in the following files: config.py:136, config.py:142, sources.py:99 and sources.py:131. The ""list-sources""-command is affected by this bug. that can result in Remote Code Execution(even as root if suricata-update is called by root). This attack appears to be exploitable via a specially crafted yaml-file at https://www.openinfosecfoundation.org/rules/index.yaml. This vulnerability appears to have been fixed in 1.0.0b1.","OISF suricata-update version 1.0.0a1 contains an Insecure Deserialization vulnerability in the insecure yaml.load-Function as used in the following files: config.py:136, config.py:142, sources.py:99 and sources.py:131. The ""list-sources""-command is affected by this bug. that can result in Remote Code Execution(even as root if suricata-update is called by root). This attack appears to be exploitable via a specially crafted yaml-file at URL This vulnerability appears to have been fixed in 1.0.0b1."
CVE-2018-3784,,0.0.6 allows,Insecure Deserialization,Unknown,9.8,CRITICAL,2018-08-17T13:29:00.407,"CWE-94, CWE-94, CWE-502",A code injection in cryo 0.0.6 allows an attacker to arbitrarily execute code due to insecure implementation of deserialization.,A code injection in cryo 0.0.6 allows an attacker to arbitrarily execute code due to insecure implementation of deserialization.
CVE-2018-15691,Release Automation,6.5 and,Remote Code Execution,Unknown,7.5,HIGH,2018-08-30T14:29:01.737,CWE-502,"Insecure deserialization of a specially crafted serialized object, in CA Release Automation 6.5 and earlier, allows attackers to potentially execute arbitrary code.","Insecure deserialization of a specially crafted serialized object, in CA Release Automation 6.5 and earlier, allows attackers to potentially execute arbitrary code."
CVE-2018-15381,Cisco Unity Express,,Command Injection,Remote,10.0,CRITICAL,2018-11-08T16:29:00.277,"CWE-502, CWE-502","A Java deserialization vulnerability in Cisco Unity Express (CUE) could allow an unauthenticated, remote attacker to execute arbitrary shell commands with the privileges of the root user. The vulnerability is due to insecure deserialization of user-supplied content by the affected software. An attacker could exploit this vulnerability by sending a malicious serialized Java object to the listening Java Remote Method Invocation (RMI) service. A successful exploit could allow the attacker to execute arbitrary commands on the device with root privileges.","A Java deserialization vulnerability in Cisco Unity Express (CUE) could allow an unauthenticated, remote attacker to execute arbitrary shell commands with the privileges of the root user. The vulnerability is due to insecure deserialization of user-supplied content by the affected software. An attacker could exploit this vulnerability by sending a malicious serialized Java object to the listening Java Remote Method Invocation (RMI) service. A successful exploit could allow the attacker to execute arbitrary commands on the device with root privileges."
CVE-2018-19276,,2.24.0 is,Command Injection,Unknown,9.8,CRITICAL,2019-03-21T16:00:30.390,CWE-502,OpenMRS before 2.24.0 is affected by an Insecure Object Deserialization vulnerability that allows an unauthenticated user to execute arbitrary commands on the targeted system via crafted XML data in a request body.,OpenMRS before 2.24.0 is affected by an Insecure Object Deserialization vulnerability that allows an unauthenticated user to execute arbitrary commands on the targeted system via crafted XML data in a request body.
CVE-2019-12240,PHP,0.4 for,Insecure Deserialization,Unknown,7.5,HIGH,2019-05-20T20:29:00.783,CWE-502,"The Virim plugin 0.4 for WordPress allows Insecure Deserialization via s_values, t_values, or c_values in graph.php.","The Virim plugin 0.4 for WordPress allows Insecure Deserialization via s_values, t_values, or c_values in graph.php."
CVE-2019-12241,PHP,1.4.5 for,Remote Code Execution,Unknown,7.5,HIGH,2019-05-20T20:29:00.847,CWE-502,The Carts Guru plugin 1.4.5 for WordPress allows Insecure Deserialization via a cartsguru-source cookie to classes/wc-cartsguru-event-handler.php.,The Carts Guru plugin 1.4.5 for WordPress allows Insecure Deserialization via a cartsguru-source cookie to classes/wc-cartsguru-event-handler.php.
CVE-2019-6980,Synacor Zimbra Collaboration Suite,"8.7.x, 8.8.11 allows",Insecure Deserialization,Unknown,7.5,HIGH,2019-05-29T22:29:01.413,CWE-502,Synacor Zimbra Collaboration Suite 8.7.x through 8.8.11 allows insecure object deserialization in the IMAP component.,Synacor Zimbra Collaboration Suite 8.7.x through 8.8.11 allows insecure object deserialization in the IMAP component.
