cve_id,software_name,affected_versions,vulnerability_type,attack_vector,cvss_score,severity,published_date,cwe_ids,description,cleaned_description
CVE-2000-1233,Phorum,3.0.7 allows,SQL Injection,Remote,7.5,HIGH,2000-12-31T05:00:00.000,Unknown,SQL injection vulnerability in read.php3 and other scripts in Phorum 3.0.7 allows remote attackers to execute arbitrary SQL queries via the sSQL parameter.,SQL injection vulnerability in read.php3 and other scripts in Phorum 3.0.7 allows remote attackers to execute arbitrary SQL queries via the sSQL parameter.
CVE-2000-1236,Oracle Internet Application Server,3.0.7 and,SQL Injection,Remote,7.5,HIGH,2000-12-31T05:00:00.000,Unknown,SQL injection vulnerability in mod_sql in Oracle Internet Application Server (IAS) 3.0.7 and earlier allows remote attackers to execute arbitrary SQL commands via the query string of the URL.,SQL injection vulnerability in mod_sql in Oracle Internet Application Server (IAS) 3.0.7 and earlier allows remote attackers to execute arbitrary SQL commands via the query string of the URL.
CVE-2001-1348,,2.6.2 and,SQL Injection,Remote,7.5,HIGH,2001-05-28T04:00:00.000,Unknown,TWIG 2.6.2 and earlier allows remote attackers to perform unauthorized database operations via a SQL injection attack on the id parameter.,TWIG 2.6.2 and earlier allows remote attackers to perform unauthorized database operations via a SQL injection attack on the id parameter.
CVE-2001-1472,PHP,"1.4.0 and, 1.4.1 allows",SQL Injection,Remote,4.6,MEDIUM,2001-08-03T04:00:00.000,Unknown,SQL injection vulnerability in prefs.php in phpBB 1.4.0 and 1.4.1 allows remote authenticated users to execute arbitrary SQL commands and gain administrative access via the viewemail parameter.,SQL injection vulnerability in prefs.php in phpBB 1.4.0 and 1.4.1 allows remote authenticated users to execute arbitrary SQL commands and gain administrative access via the viewemail parameter.
CVE-2001-1379,PostgreSQL,"0.9.5, 0.9.4",SQL Injection,Remote,7.5,HIGH,2001-08-29T04:00:00.000,Unknown,"The PostgreSQL authentication modules (1) mod_auth_pgsql 0.9.5, and (2) mod_auth_pgsql_sys 0.9.4, allow remote attackers to bypass authentication and execute arbitrary SQL via a SQL injection attack on the user name.","The PostgreSQL authentication modules (1) mod_auth_pgsql 0.9.5, and (2) mod_auth_pgsql_sys 0.9.4, allow remote attackers to bypass authentication and execute arbitrary SQL via a SQL injection attack on the user name."
CVE-2001-1402,Bugzilla,2.14 does,SQL Injection,Remote,7.5,HIGH,2001-09-10T04:00:00.000,Unknown,"Bugzilla before 2.14 does not properly escape untrusted parameters, which could allow remote attackers to conduct unauthorized activities via cross-site scripting (CSS) and possibly SQL injection attacks on (1) the product or output form variables for reports.cgi, (2) the voteon, bug_id, and user variables for showvotes.cgi, (3) an invalid email address in createaccount.cgi, (4) an invalid ID in showdependencytree.cgi, (5) invalid usernames and other fields in process_bug.cgi, and (6) error messages in buglist.cgi.","Bugzilla before 2.14 does not properly escape untrusted parameters, which could allow remote attackers to conduct unauthorized activities via cross-site scripting (CSS) and possibly SQL injection attacks on (1) the product or output form variables for reports.cgi, (2) the voteon, bug_id, and user variables for showvotes.cgi, (3) an invalid email address in createaccount.cgi, (4) an invalid ID in showdependencytree.cgi, (5) invalid usernames and other fields in process_bug.cgi, and (6) error messages in buglist.cgi."
CVE-2001-1460,PostNuke,"0.62 through, 0.64 allows",SQL Injection,Remote,7.5,HIGH,2001-10-13T04:00:00.000,Unknown,SQL injection vulnerability in article.php in PostNuke 0.62 through 0.64 allows remote attackers to bypass authentication via the user parameter.,SQL injection vulnerability in article.php in PostNuke 0.62 through 0.64 allows remote attackers to bypass authentication via the user parameter.
CVE-2001-1224,Pro,2.0 allows,SQL Injection,Remote,7.5,HIGH,2001-12-23T05:00:00.000,Unknown,get_input in adrotate.pm for Les VanBrunt AdRotate Pro 2.0 allows remote attackers to modify the database and possibly execute arbitrary commands via a SQL code injection attack.,get_input in adrotate.pm for Les VanBrunt AdRotate Pro 2.0 allows remote attackers to modify the database and possibly execute arbitrary commands via a SQL code injection attack.
CVE-2001-1482,PHP,1.4.2 allows,SQL Injection,Remote,7.5,HIGH,2001-12-31T05:00:00.000,Unknown,SQL injection vulnerability in bb_memberlist.php for phpBB 1.4.2 allows remote attackers to execute arbitrary SQL queries via the $sortby variable.,SQL injection vulnerability in bb_memberlist.php for phpBB 1.4.2 allows remote attackers to execute arbitrary SQL queries via the $sortby variable.
CVE-2002-0216,XOOPS,1.0 RC1,SQL Injection,Remote,5.0,MEDIUM,2002-05-16T04:00:00.000,Unknown,"userinfo.php in XOOPS 1.0 RC1 allows remote attackers to obtain sensitive information via a SQL injection attack in the ""uid"" parameter.","userinfo.php in XOOPS 1.0 RC1 allows remote attackers to obtain sensitive information via a SQL injection attack in the ""uid"" parameter."
CVE-1999-1357,Netscape Communicator,"4.04 through, 4.7",Cross-Site Scripting,Remote,7.5,HIGH,1999-10-05T04:00:00.000,Unknown,"Netscape Communicator 4.04 through 4.7 (and possibly other versions) in various UNIX operating systems converts the 0x8b character to a ""<"" sign, and the 0x9b character to a "">"" sign, which could allow remote attackers to attack other clients via cross-site scripting (CSS) in CGI programs that do not filter these characters.","Netscape Communicator 4.04 through 4.7 (and possibly other versions) in various UNIX operating systems converts the 0x8b character to a """" sign, which could allow remote attackers to attack other clients via cross-site scripting (CSS) in CGI programs that do not filter these characters."
CVE-1999-1167,Third Voice Web,,Cross-Site Scripting,Remote,6.4,MEDIUM,1999-12-31T05:00:00.000,Unknown,Cross-site scripting vulnerability in Third Voice Web annotation utility allows remote users to read sensitive data and generate fake web pages for other Third Voice users by injecting malicious Javascript into an annotation.,Cross-site scripting vulnerability in Third Voice Web annotation utility allows remote users to read sensitive data and generate fake web pages for other Third Voice users by injecting malicious Javascript into an annotation.
CVE-2000-0746,IIS,"4.0 and, 5.0 do",Cross-Site Scripting,Unknown,7.5,HIGH,2000-10-20T04:00:00.000,Unknown,"Vulnerabilities in IIS 4.0 and 5.0 do not properly protect against cross-site scripting (CSS) attacks.  They allow a malicious web site operator to embed scripts in a link to a trusted site, which are returned without quoting in an error message back to the client.  The client then executes those scripts in the same context as the trusted site, aka the ""IIS Cross-Site Scripting"" vulnerabilities.","Vulnerabilities in IIS 4.0 and 5.0 do not properly protect against cross-site scripting (CSS) attacks. They allow a malicious web site operator to embed scripts in a link to a trusted site, which are returned without quoting in an error message back to the client. The client then executes those scripts in the same context as the trusted site, aka the ""IIS Cross-Site Scripting"" vulnerabilities."
CVE-2000-1053,,2.3.3 server,Cross-Site Scripting,Remote,10.0,CRITICAL,2000-12-11T05:00:00.000,Unknown,Allaire JRun 2.3.3 server allows remote attackers to compile and execute JSP code by inserting it via a cross-site scripting (CSS) attack and directly calling the com.livesoftware.jrun.plugins.JSP JSP servlet.,Allaire JRun 2.3.3 server allows remote attackers to compile and execute JSP code by inserting it via a cross-site scripting (CSS) attack and directly calling the com.livesoftware.jrun.plugins.JSP JSP servlet.
CVE-2000-1104,MS,,Cross-Site Scripting,Unknown,7.5,HIGH,2001-01-09T05:00:00.000,Unknown,"Variant of the ""IIS Cross-Site Scripting"" vulnerability as originally discussed in MS:MS00-060 (CVE-2000-0746) allows a malicious web site operator to embed scripts in a link to a trusted site, which are returned without quoting in an error message back to the client.  The client then executes those scripts in the same context as the trusted site.","Variant of the ""IIS Cross-Site Scripting"" vulnerability as originally discussed in MS:MS00-060 (CVE-2000-0746) allows a malicious web site operator to embed scripts in a link to a trusted site, which are returned without quoting in an error message back to the client. The client then executes those scripts in the same context as the trusted site."
CVE-2001-1416,,4.4 allow,Cross-Site Scripting,Remote,5.1,MEDIUM,2001-01-18T05:00:00.000,Unknown,"Multiple cross-site scripting (XSS) vulnerabilities in the log messages in certain Alpha versions of AOL Instant Messenger (AIM) 4.4 allow remote attackers to execute arbitrary web script or HTML via an image in the (1) DATA, (2) STYLE, or (3) BINARY tags.","Multiple cross-site scripting (XSS) vulnerabilities in the log messages in certain Alpha versions of AOL Instant Messenger (AIM) 4.4 allow remote attackers to execute arbitrary web script or HTML via an image in the (1) DATA, (2) STYLE, or (3) BINARY tags."
CVE-2001-1084,Allaire JRun,"3.0 and, 2.3.3 allows",Cross-Site Scripting,Unknown,7.5,HIGH,2001-07-02T04:00:00.000,Unknown,"Cross-site scripting vulnerability in Allaire JRun 3.0 and 2.3.3 allows a malicious webmaster to embed Javascript in a request for a .JSP, .shtml, .jsp10, .jrun, or .thtml file that does not exist, which causes the Javascript to be inserted into an error message.","Cross-site scripting vulnerability in Allaire JRun 3.0 and 2.3.3 allows a malicious webmaster to embed Javascript in a request for a .JSP, .shtml, .jsp10, .jrun, or .thtml file that does not exist, which causes the Javascript to be inserted into an error message."
CVE-2001-1161,Lotus Domino,5.0.6 allows,Cross-Site Scripting,Remote,7.5,HIGH,2001-07-02T04:00:00.000,Unknown,"Cross-site scripting (CSS) vulnerability in Lotus Domino 5.0.6 allows remote attackers to execute script on other web clients via a URL that ends in Javascript, which generates an error message that does not quote the resulting script.","Cross-site scripting (CSS) vulnerability in Lotus Domino 5.0.6 allows remote attackers to execute script on other web clients via a URL that ends in Javascript, which generates an error message that does not quote the resulting script."
CVE-2001-1441,Java,3.5 Professional,Cross-Site Scripting,Remote,6.8,MEDIUM,2001-07-02T04:00:00.000,Unknown,"Cross-site scripting (XSS) vulnerability in VisualAge for Java 3.5 Professional allows remote attackers to execute JavaScript on other clients via the URL, which injects the script in the resulting error message.","Cross-site scripting (XSS) vulnerability in VisualAge for Java 3.5 Professional allows remote attackers to execute JavaScript on other clients via the URL, which injects the script in the resulting error message."
CVE-2001-1257,Horde Internet Messaging Program,"2.2.6 and, 1.2.6 allows",Cross-Site Scripting,Remote,7.5,HIGH,2001-07-21T04:00:00.000,Unknown,Cross-site scripting vulnerability in Horde Internet Messaging Program (IMP) before 2.2.6 and 1.2.6 allows remote attackers to execute arbitrary Javascript embedded in an email.,Cross-site scripting vulnerability in Horde Internet Messaging Program (IMP) before 2.2.6 and 1.2.6 allows remote attackers to execute arbitrary Javascript embedded in an email.
CVE-2002-1648,SquirrelMail,1.2.3 allows,Cross-Site Request Forgery,Remote,7.5,HIGH,2002-12-31T05:00:00.000,Unknown,Cross-site request forgery (CSRF) vulnerability in compose.php in SquirrelMail before 1.2.3 allows remote attackers to send email as other users via an IMG URL with modified send_to and subject parameters.,Cross-site request forgery (CSRF) vulnerability in compose.php in SquirrelMail before 1.2.3 allows remote attackers to send email as other users via an IMG URL with modified send_to and subject parameters.
CVE-2002-2426,Citrix Presentation Server,"4.0 and, 4.5, 3.0, 1.0 through, 2.0 allows",Cross-Site Request Forgery,Remote,4.3,MEDIUM,2002-12-31T05:00:00.000,CWE-352,"Cross-site request forgery (CSRF) vulnerability in Citrix Presentation Server 4.0 and 4.5, MetaFrame Presentation Server 3.0, and Access Essentials 1.0 through 2.0 allows remote attackers to execute arbitrary published applications, and possibly other programs, as authenticated users via the InitialProgram key in an ICA connection. NOTE: some of these details are obtained from third party information.","Cross-site request forgery (CSRF) vulnerability in Citrix Presentation Server 4.0 and 4.5, MetaFrame Presentation Server 3.0, and Access Essentials 1.0 through 2.0 allows remote attackers to execute arbitrary published applications, and possibly other programs, as authenticated users via the InitialProgram key in an ICA connection. NOTE: some of these details are obtained from third party information."
CVE-2004-1967,Open Bulletin Board,1.0.6 and,Cross-Site Request Forgery,Remote,8.8,HIGH,2004-04-25T04:00:00.000,CWE-352,"Cross-site request forgery (CSRF) vulnerabilities in (1) cp_forums.php, (2) cp_usergroup.php, (3) cp_ipbans.php, (4) myhome.php, (5) post.php, or (6) moderator.php in Open Bulletin Board (OpenBB) 1.0.6 and earlier allow remote attackers to execute arbitrary code by including the code in an image tag or a link.","Cross-site request forgery (CSRF) vulnerabilities in (1) cp_forums.php, (2) cp_usergroup.php, (3) cp_ipbans.php, (4) myhome.php, (5) post.php, or (6) moderator.php in Open Bulletin Board (OpenBB) 1.0.6 and earlier allow remote attackers to execute arbitrary code by including the code in an image tag or a link."
CVE-2004-1842,Php,7.1.0 allows,Cross-Site Request Forgery,Remote,8.8,HIGH,2004-12-31T05:00:00.000,CWE-352,Cross-site request forgery (CSRF) vulnerability in Php-Nuke 6.x through 7.1.0 allows remote attackers to gain administrative privileges via an img tag with a URL to admin.php.,Cross-site request forgery (CSRF) vulnerability in Php-Nuke 6.x through 7.1.0 allows remote attackers to gain administrative privileges via an img tag with a URL to admin.php.
CVE-2004-1995,FuseTalk,2.0 allows,Cross-Site Request Forgery,Remote,6.5,MEDIUM,2004-12-31T05:00:00.000,CWE-352,Cross-Site Request Forgery (CSRF) vulnerability in FuseTalk 2.0 allows remote attackers to create arbitrary accounts via a link to adduser.cfm.,Cross-Site Request Forgery (CSRF) vulnerability in FuseTalk 2.0 allows remote attackers to create arbitrary accounts via a link to adduser.cfm.
CVE-2004-2364,PHPX,"3.0 through, 3.2.6 allows",Cross-Site Request Forgery,Remote,5.0,MEDIUM,2004-12-31T05:00:00.000,Unknown,"Cross-site request forgery (CSRF) vulnerability in PHPX 3.0 through 3.2.6 allows remote attackers to execute arbitrary commands via URLs that are automatically executed on behalf of the administrator, as demonstrated using (1) admin/page.php, (2) admin/news.php, (3) admin/user.php, (4) admin/images.php, (5) admin/page.php, or (6) admin/forums.php.","Cross-site request forgery (CSRF) vulnerability in PHPX 3.0 through 3.2.6 allows remote attackers to execute arbitrary commands via URLs that are automatically executed on behalf of the administrator, as demonstrated using (1) admin/page.php, (2) admin/news.php, (3) admin/user.php, (4) admin/images.php, (5) admin/page.php, or (6) admin/forums.php."
CVE-2004-2403,YaBB,1.3.2 allows,Cross-Site Request Forgery,Remote,10.0,CRITICAL,2004-12-31T05:00:00.000,Unknown,"Cross-site request forgery (CSRF) vulnerability in YaBB 1 GOLD SP 1.3.2 allows remote attackers to perform unauthorized actions as the administrative user via a link or IMG tag to YaBB.pl that specifies the desired action, id, and moda parameters.","Cross-site request forgery (CSRF) vulnerability in YaBB 1 GOLD SP 1.3.2 allows remote attackers to perform unauthorized actions as the administrative user via a link or IMG tag to YaBB.pl that specifies the desired action, id, and moda parameters."
CVE-2005-0535,MediaWiki,"1.3.x, 1.3.11 and, 1.4 beta, 1.4 rc1",Cross-Site Request Forgery,Remote,7.5,HIGH,2005-02-22T05:00:00.000,Unknown,Cross-site request forgery (CSRF) vulnerability in MediaWiki 1.3.x before 1.3.11 and 1.4 beta before 1.4 rc1 allows remote attackers to perform unauthorized actions as authenticated MediaWiki users.,Cross-site request forgery (CSRF) vulnerability in MediaWiki 1.3.x before 1.3.11 and 1.4 beta before 1.4 rc1 allows remote attackers to perform unauthorized actions as authenticated MediaWiki users.
CVE-2005-1674,Help Center Live,,Cross-Site Request Forgery,Remote,6.5,MEDIUM,2005-05-19T04:00:00.000,"CWE-352, CWE-352",Cross-Site Request Forgery (CSRF) vulnerability in Help Center Live allows remote attackers to perform actions as the administrator via a link or IMG tag to view.php.,Cross-Site Request Forgery (CSRF) vulnerability in Help Center Live allows remote attackers to perform actions as the administrator via a link or IMG tag to view.php.
CVE-2005-1947,Invision Gallery,1.3.1 allows,Cross-Site Request Forgery,Remote,4.3,MEDIUM,2005-06-09T04:00:00.000,CWE-352,Cross-site request forgery (CSRF) vulnerability in Invision Gallery before 1.3.1 allows remote attackers to delete albums and images as another user via a link or IMG tag to the (1) albums or (2) delimg actions.,Cross-site request forgery (CSRF) vulnerability in Invision Gallery before 1.3.1 allows remote attackers to delete albums and images as another user via a link or IMG tag to the (1) albums or (2) delimg actions.
CVE-1999-0244,,,Buffer Overflow,Remote,7.5,HIGH,1997-12-01T05:00:00.000,Unknown,Livingston RADIUS code has a buffer overflow which can allow remote execution of commands as root.,Livingston RADIUS code has a buffer overflow which can allow remote execution of commands as root.
CVE-1999-0440,The,,,Remote,7.5,HIGH,1999-03-01T05:00:00.000,Unknown,The byte code verifier component of the Java Virtual Machine (JVM) allows remote execution through malicious web pages.,The byte code verifier component of the Java Virtual Machine (JVM) allows remote execution through malicious web pages.
CVE-2001-1283,,7.04 and,Buffer Overflow,Remote,7.5,HIGH,2001-10-12T04:00:00.000,Unknown,"The webmail interface for Ipswitch IMail 7.04 and earlier allows remote authenticated users to cause a denial of service (crash) via a mailbox name that contains a large number of . (dot) or other characters to programs such as (1) readmail.cgi or (2) printmail.cgi, possibly due to a buffer overflow that may allow execution of arbitrary code.","The webmail interface for Ipswitch IMail 7.04 and earlier allows remote authenticated users to cause a denial of service (crash) via a mailbox name that contains a large number of . (dot) or other characters to programs such as (1) readmail.cgi or (2) printmail.cgi, possibly due to a buffer overflow that may allow execution of arbitrary code."
CVE-2001-0727,Internet Explorer,6.0 allows,Remote Code Execution,Remote,7.5,HIGH,2001-12-14T05:00:00.000,Unknown,"Internet Explorer 6.0 allows remote attackers to execute arbitrary code by modifying the Content-Disposition and Content-Type header fields in a way that causes Internet Explorer to believe that the file is safe to open without prompting the user, aka the ""File Execution Vulnerability.""","Internet Explorer 6.0 allows remote attackers to execute arbitrary code by modifying the Content-Disposition and Content-Type header fields in a way that causes Internet Explorer to believe that the file is safe to open without prompting the user, aka the ""File Execution Vulnerability."""
CVE-2002-0618,Microsoft Excel,,,Remote,7.5,HIGH,2002-08-12T04:00:00.000,Unknown,"The Macro Security Model in Microsoft Excel 2000 and 2002 for Windows allows remote attackers to execute code in the Local Computer zone by embedding HTML scripts within an Excel workbook that contains an XSL stylesheet, aka ""Excel XSL Stylesheet Script Execution"".","The Macro Security Model in Microsoft Excel 2000 and 2002 for Windows allows remote attackers to execute code in the Local Computer zone by embedding HTML scripts within an Excel workbook that contains an XSL stylesheet, aka ""Excel XSL Stylesheet Script Execution""."
CVE-2002-0694,Microsoft Windows,"4.0, 4.0 Terminal",Remote Code Execution,Remote,7.5,HIGH,2002-10-10T04:00:00.000,Unknown,"The HTML Help facility in Microsoft Windows 98, 98 Second Edition, Millennium Edition, NT 4.0, NT 4.0 Terminal Server Edition, Windows 2000, and Windows XP uses the Local Computer Security Zone when opening .chm files from the Temporary Internet Files folder, which allows remote attackers to execute arbitrary code via HTML mail that references or inserts a malicious .chm file containing shortcuts that can be executed, aka ""Code Execution via Compiled HTML Help File.""","The HTML Help facility in Microsoft Windows 98, 98 Second Edition, Millennium Edition, NT 4.0, NT 4.0 Terminal Server Edition, Windows 2000, and Windows XP uses the Local Computer Security Zone when opening .chm files from the Temporary Internet Files folder, which allows remote attackers to execute arbitrary code via HTML mail that references or inserts a malicious .chm file containing shortcuts that can be executed, aka ""Code Execution via Compiled HTML Help File."""
CVE-2002-1870,,"0.0.4 through, 0.1.0 does",Denial of Service,Remote,7.5,HIGH,2002-12-31T05:00:00.000,Unknown,"Simple Web Server (SWS) 0.0.4 through 0.1.0 does not properly handle when the recv function call fails, which may allow remote attackers to overwrite program data or perform actions on an uninitialized heap, leading to a denial of service and possibly code execution.","Simple Web Server (SWS) 0.0.4 through 0.1.0 does not properly handle when the recv function call fails, which may allow remote attackers to overwrite program data or perform actions on an uninitialized heap, leading to a denial of service and possibly code execution."
CVE-2003-1094,,7.0 SP3,,Remote,7.2,HIGH,2003-12-31T05:00:00.000,Unknown,"BEA WebLogic Server and Express version 7.0 SP3 may follow certain code execution paths that result in an incorrect current user, such as in the frequent use of JNDI initial contexts, which could allow remote authenticated users to gain privileges.","BEA WebLogic Server and Express version 7.0 SP3 may follow certain code execution paths that result in an incorrect current user, such as in the frequent use of JNDI initial contexts, which could allow remote authenticated users to gain privileges."
CVE-2004-0594,PHP,"4.3.7, 5.0.0RC3",Remote Code Execution,Remote,5.1,MEDIUM,2004-07-27T04:00:00.000,CWE-367,"The memory_limit functionality in PHP 4.x up to 4.3.7, and 5.x up to 5.0.0RC3, under certain conditions such as when register_globals is enabled, allows remote attackers to execute arbitrary code by triggering a memory_limit abort during execution of the zend_hash_init function and overwriting a HashTable destructor pointer before the initialization of key data structures is complete.","The memory_limit functionality in PHP 4.x up to 4.3.7, and 5.x up to 5.0.0RC3, under certain conditions such as when register_globals is enabled, allows remote attackers to execute arbitrary code by triggering a memory_limit abort during execution of the zend_hash_init function and overwriting a HashTable destructor pointer before the initialization of key data structures is complete."
CVE-2004-2560,PHP,,Remote Code Execution,Remote,7.5,HIGH,2004-12-31T05:00:00.000,Unknown,"DokuWiki before 2004-10-19, when used on a web server that permits execution based on file extension, allows remote attackers to execute arbitrary code by uploading a file with an appropriate extension such as "".php"" or "".cgi"".","DokuWiki before 2004-10-19, when used on a web server that permits execution based on file extension, allows remote attackers to execute arbitrary code by uploading a file with an appropriate extension such as "".php"" or "".cgi""."
CVE-1999-0168,,,,Local,7.5,HIGH,1992-06-04T04:00:00.000,Unknown,"The portmapper may act as a proxy and redirect service requests from an attacker, making the request appear to come from the local host, possibly bypassing authentication that would otherwise have taken place.  For example, NFS file systems could be mounted through the portmapper despite export restrictions.","The portmapper may act as a proxy and redirect service requests from an attacker, making the request appear to come from the local host, possibly bypassing authentication that would otherwise have taken place. For example, NFS file systems could be mounted through the portmapper despite export restrictions."
CVE-1999-1311,HP,"10.20 and, 10.10 allows",Authentication Bypass,Local,4.6,MEDIUM,1997-01-07T05:00:00.000,Unknown,Vulnerability in dtlogin and dtsession in HP-UX 10.20 and 10.10 allows local users to bypass authentication and gain privileges.,Vulnerability in dtlogin and dtsession in HP-UX 10.20 and 10.10 allows local users to bypass authentication and gain privileges.
CVE-1999-1481,Squid,2.2.STABLE5,,Unknown,5.0,MEDIUM,1999-12-31T05:00:00.000,Unknown,"Squid 2.2.STABLE5 and below, when using external authentication, allows attackers to bypass access controls via a newline in the user/password pair.","Squid 2.2.STABLE5 and below, when using external authentication, allows attackers to bypass access controls via a newline in the user/password pair."
