cve_id,description,cvss_score,severity,published_date,cwe_ids,cleaned_description,extracted_entities,tokens,token_count,sentences,sentence_count
CVE-2012-3363,"Zend_XmlRpc in Zend Framework 1.x before 1.11.12 and 1.12.x before 1.12.0 does not properly handle SimpleXMLElement classes, which allows remote attackers to read arbitrary files or create TCP connections via an external entity reference in a DOCTYPE element in an XML-RPC request, aka an XML external entity (XXE) injection attack.",9.1,CRITICAL,2013-02-13T17:55:01.320,"CWE-611, CWE-611","Zend_XmlRpc in Zend Framework 1.x before 1.11.12 and 1.12.x before 1.12.0 does not properly handle SimpleXMLElement classes, which allows remote attackers to read arbitrary files or create TCP connections via an external entity reference in a DOCTYPE element in an XML-RPC request, aka an XML external entity (XXE) injection attack.","{'version': ['1.11.12', '1.12.', '1.12.0']}","['zend_xmlrpc', 'in', 'zend', 'framework', '1.x', 'before', '1.11.12', 'and', '1.12.x', 'before', '1.12.0', 'does', 'not', 'properly', 'handle', 'simplexmlelement', 'classes', 'which', 'allows', 'remote', 'attackers', 'to', 'read', 'arbitrary', 'files', 'or', 'create', 'tcp', 'connections', 'via', 'an', 'external', 'entity', 'reference', 'in', 'doctype', 'element', 'in', 'an', 'xml-rpc', 'request', 'aka', 'an', 'xml', 'external', 'entity', 'xxe', 'injection', 'attack']",49,"['Zend_XmlRpc in Zend Framework 1.x before 1.11.12 and 1.12.x before 1.12.0 does not properly handle SimpleXMLElement classes, which allows remote attackers to read arbitrary files or create TCP connections via an external entity reference in a DOCTYPE element in an XML-RPC request, aka an XML external entity (XXE) injection attack.']",1
CVE-2012-6531,"(1) Zend_Dom, (2) Zend_Feed, and (3) Zend_Soap in Zend Framework 1.x before 1.11.13 and 1.12.x before 1.12.0 do not properly handle SimpleXMLElement classes, which allow remote attackers to read arbitrary files or create TCP connections via an external entity reference in a DOCTYPE element in an XML-RPC request, aka an XML external entity (XXE) injection attack, a different vulnerability than CVE-2012-3363.",6.4,MEDIUM,2013-02-13T17:55:01.417,CWE-20,"(1) Zend_Dom, (2) Zend_Feed, and (3) Zend_Soap in Zend Framework 1.x before 1.11.13 and 1.12.x before 1.12.0 do not properly handle SimpleXMLElement classes, which allow remote attackers to read arbitrary files or create TCP connections via an external entity reference in a DOCTYPE element in an XML-RPC request, aka an XML external entity (XXE) injection attack, a different vulnerability than CVE-2012-3363.","{'cve_id': ['CVE-2012-3363'], 'version': ['1.11.13', '1.12.', '1.12.0']}","['zend_dom', 'zend_feed', 'and', 'zend_soap', 'in', 'zend', 'framework', '1.x', 'before', '1.11.13', 'and', '1.12.x', 'before', '1.12.0', 'do', 'not', 'properly', 'handle', 'simplexmlelement', 'classes', 'which', 'allow', 'remote', 'attackers', 'to', 'read', 'arbitrary', 'files', 'or', 'create', 'tcp', 'connections', 'via', 'an', 'external', 'entity', 'reference', 'in', 'doctype', 'element', 'in', 'an', 'xml-rpc', 'request', 'aka', 'an', 'xml', 'external', 'entity', 'xxe', 'injection', 'attack', 'different', 'vulnerability', 'than', 'cve-2012-3363']",56,"['(1) Zend_Dom, (2) Zend_Feed, and (3) Zend_Soap in Zend Framework 1.x before 1.11.13 and 1.12.x before 1.12.0 do not properly handle SimpleXMLElement classes, which allow remote attackers to read arbitrary files or create TCP connections via an external entity reference in a DOCTYPE element in an XML-RPC request, aka an XML external entity (XXE) injection attack, a different vulnerability than CVE-2012-3363.']",1
CVE-2013-1140,"The XML parser in Cisco Security Monitoring, Analysis, and Response System (MARS) allows remote attackers to read arbitrary files via an external entity declaration in conjunction with an entity reference, related to an XML External Entity (XXE) issue, aka Bug ID CSCue55093.",4.3,MEDIUM,2013-03-06T13:10:25.970,CWE-200,"The XML parser in Cisco Security Monitoring, Analysis, and Response System (MARS) allows remote attackers to read arbitrary files via an external entity declaration in conjunction with an entity reference, related to an XML External Entity (XXE) issue, aka Bug ID CSCue55093.",{},"['the', 'xml', 'parser', 'in', 'cisco', 'security', 'monitoring', 'analysis', 'and', 'response', 'system', 'mars', 'allows', 'remote', 'attackers', 'to', 'read', 'arbitrary', 'files', 'via', 'an', 'external', 'entity', 'declaration', 'in', 'conjunction', 'with', 'an', 'entity', 'reference', 'related', 'to', 'an', 'xml', 'external', 'entity', 'xxe', 'issue', 'aka', 'bug', 'id', 'cscue55093']",42,"['The XML parser in Cisco Security Monitoring, Analysis, and Response System (MARS) allows remote attackers to read arbitrary files via an external entity declaration in conjunction with an entity reference, related to an XML External Entity (XXE) issue, aka Bug ID CSCue55093.']",1
CVE-2013-1643,"The SOAP parser in PHP before 5.3.23 and 5.4.x before 5.4.13 allows remote attackers to read arbitrary files via a SOAP WSDL file containing an XML external entity declaration in conjunction with an entity reference, related to an XML External Entity (XXE) issue in the soap_xmlParseFile and soap_xmlParseMemory functions.  NOTE: this vulnerability exists because of an incorrect fix for CVE-2013-1824.",5.0,MEDIUM,2013-03-06T13:10:27.230,CWE-200,"The SOAP parser in PHP before 5.3.23 and 5.4.x before 5.4.13 allows remote attackers to read arbitrary files via a SOAP WSDL file containing an XML external entity declaration in conjunction with an entity reference, related to an XML External Entity (XXE) issue in the soap_xmlParseFile and soap_xmlParseMemory functions. NOTE: this vulnerability exists because of an incorrect fix for CVE-2013-1824.","{'cve_id': ['CVE-2013-1824'], 'version': ['5.3.23', '5.4.', '5.4.13']}","['the', 'soap', 'parser', 'in', 'php', 'before', '5.3.23', 'and', '5.4.x', 'before', '5.4.13', 'allows', 'remote', 'attackers', 'to', 'read', 'arbitrary', 'files', 'via', 'soap', 'wsdl', 'file', 'containing', 'an', 'xml', 'external', 'entity', 'declaration', 'in', 'conjunction', 'with', 'an', 'entity', 'reference', 'related', 'to', 'an', 'xml', 'external', 'entity', 'xxe', 'issue', 'in', 'the', 'soap_xmlparsefile', 'and', 'soap_xmlparsememory', 'functions', 'note', 'this', 'vulnerability', 'exists', 'because', 'of', 'an', 'incorrect', 'fix', 'for', 'cve-2013-1824']",59,"['The SOAP parser in PHP before 5.3.23 and 5.4.x before 5.4.13 allows remote attackers to read arbitrary files via a SOAP WSDL file containing an XML external entity declaration in conjunction with an entity reference, related to an XML External Entity (XXE) issue in the soap_xmlParseFile and soap_xmlParseMemory functions.', 'NOTE: this vulnerability exists because of an incorrect fix for CVE-2013-1824.']",2
CVE-2013-1856,"The ActiveSupport::XmlMini_JDOM backend in lib/active_support/xml_mini/jdom.rb in the Active Support component in Ruby on Rails 3.0.x and 3.1.x before 3.1.12 and 3.2.x before 3.2.13, when JRuby is used, does not properly restrict the capabilities of the XML parser, which allows remote attackers to read arbitrary files or cause a denial of service (resource consumption) via vectors involving (1) an external DTD or (2) an external entity declaration in conjunction with an entity reference.",5.8,MEDIUM,2013-03-19T22:55:01.070,CWE-20,"The ActiveSupport::XmlMini_JDOM backend in lib/active_support/xml_mini/jdom.rb in the Active Support component in Ruby on Rails 3.0.x and 3.1.x before 3.1.12 and 3.2.x before 3.2.13, when JRuby is used, does not properly restrict the capabilities of the XML parser, which allows remote attackers to read arbitrary files or cause a denial of service (resource consumption) via vectors involving (1) an external DTD or (2) an external entity declaration in conjunction with an entity reference.","{'version': ['3.0.', '3.1.', '3.1.12', '3.2.', '3.2.13']}","['the', 'activesupport', ':xmlmini_jdom', 'backend', 'in', 'lib/active_support/xml_mini/jdom.rb', 'in', 'the', 'active', 'support', 'component', 'in', 'ruby', 'on', 'rails', '3.0.x', 'and', '3.1.x', 'before', '3.1.12', 'and', '3.2.x', 'before', '3.2.13', 'when', 'jruby', 'is', 'used', 'does', 'not', 'properly', 'restrict', 'the', 'capabilities', 'of', 'the', 'xml', 'parser', 'which', 'allows', 'remote', 'attackers', 'to', 'read', 'arbitrary', 'files', 'or', 'cause', 'denial', 'of', 'service', 'resource', 'consumption', 'via', 'vectors', 'involving', 'an', 'external', 'dtd', 'or', 'an', 'external', 'entity', 'declaration', 'in', 'conjunction', 'with', 'an', 'entity', 'reference']",70,"['The ActiveSupport::XmlMini_JDOM backend in lib/active_support/xml_mini/jdom.rb in the Active Support component in Ruby on Rails 3.0.x and 3.1.x before 3.1.12 and 3.2.x before 3.2.13, when JRuby is used, does not properly restrict the capabilities of the XML parser, which allows remote attackers to read arbitrary files or cause a denial of service (resource consumption) via vectors involving (1) an external DTD or (2) an external entity declaration in conjunction with an entity reference.']",1
CVE-2013-1665,"The XML libraries for Python 3.4, 3.3, 3.2, 3.1, 2.7, and 2.6, as used in OpenStack Keystone Essex and Folsom, Django, and possibly other products allow remote attackers to read arbitrary files via an XML external entity declaration in conjunction with an entity reference, aka an XML External Entity (XXE) attack.",5.0,MEDIUM,2013-04-03T00:55:02.207,CWE-200,"The XML libraries for Python 3.4, 3.3, 3.2, 3.1, 2.7, and 2.6, as used in OpenStack Keystone Essex and Folsom, Django, and possibly other products allow remote attackers to read arbitrary files via an XML external entity declaration in conjunction with an entity reference, aka an XML External Entity (XXE) attack.","{'version': ['3.4', '3.3', '3.2', '3.1', '2.7', '2.6']}","['the', 'xml', 'libraries', 'for', 'python', '3.4', '3.3', '3.2', '3.1', '2.7', 'and', '2.6', 'as', 'used', 'in', 'openstack', 'keystone', 'essex', 'and', 'folsom', 'django', 'and', 'possibly', 'other', 'products', 'allow', 'remote', 'attackers', 'to', 'read', 'arbitrary', 'files', 'via', 'an', 'xml', 'external', 'entity', 'declaration', 'in', 'conjunction', 'with', 'an', 'entity', 'reference', 'aka', 'an', 'xml', 'external', 'entity', 'xxe', 'attack']",51,"['The XML libraries for Python 3.4, 3.3, 3.2, 3.1, 2.7, and 2.6, as used in OpenStack Keystone Essex and Folsom, Django, and possibly other products allow remote attackers to read arbitrary files via an XML external entity declaration in conjunction with an entity reference, aka an XML External Entity (XXE) attack.']",1
CVE-2018-0147,"A vulnerability in Java deserialization used by Cisco Secure Access Control System (ACS) prior to release 5.8 patch 9 could allow an unauthenticated, remote attacker to execute arbitrary commands on an affected device. The vulnerability is due to insecure deserialization of user-supplied content by the affected software. An attacker could exploit this vulnerability by sending a crafted serialized Java object. An exploit could allow the attacker to execute arbitrary commands on the device with root privileges. Cisco Bug IDs: CSCvh25988.",9.8,CRITICAL,2018-03-08T07:29:00.377,"CWE-20, CWE-502","A vulnerability in Java deserialization used by Cisco Secure Access Control System (ACS) prior to release 5.8 patch 9 could allow an unauthenticated, remote attacker to execute arbitrary commands on an affected device. The vulnerability is due to insecure deserialization of user-supplied content by the affected software. An attacker could exploit this vulnerability by sending a crafted serialized Java object. An exploit could allow the attacker to execute arbitrary commands on the device with root privileges. Cisco Bug IDs: CSCvh25988.",{'version': ['5.8']},"['vulnerability', 'in', 'java', 'deserialization', 'used', 'by', 'cisco', 'secure', 'access', 'control', 'system', 'acs', 'prior', 'to', 'release', '5.8', 'patch', 'could', 'allow', 'an', 'unauthenticated', 'remote', 'attacker', 'to', 'execute', 'arbitrary', 'commands', 'on', 'an', 'affected', 'device', 'the', 'vulnerability', 'is', 'due', 'to', 'insecure', 'deserialization', 'of', 'user-supplied', 'content', 'by', 'the', 'affected', 'software', 'an', 'attacker', 'could', 'exploit', 'this', 'vulnerability', 'by', 'sending', 'crafted', 'serialized', 'java', 'object', 'an', 'exploit', 'could', 'allow', 'the', 'attacker', 'to', 'execute', 'arbitrary', 'commands', 'on', 'the', 'device', 'with', 'root', 'privileges', 'cisco', 'bug', 'ids', 'cscvh25988']",77,"['A vulnerability in Java deserialization used by Cisco Secure Access Control System (ACS) prior to release 5.8 patch 9 could allow an unauthenticated, remote attacker to execute arbitrary commands on an affected device.', 'The vulnerability is due to insecure deserialization of user-supplied content by the affected software.', 'An attacker could exploit this vulnerability by sending a crafted serialized Java object.', 'An exploit could allow the attacker to execute arbitrary commands on the device with root privileges.', 'Cisco Bug IDs: CSCvh25988.']",5
CVE-2018-1000167,"OISF suricata-update version 1.0.0a1 contains an Insecure Deserialization vulnerability in the insecure yaml.load-Function as used in the following files: config.py:136, config.py:142, sources.py:99 and sources.py:131. The ""list-sources""-command is affected by this bug. that can result in Remote Code Execution(even as root if suricata-update is called by root). This attack appears to be exploitable via a specially crafted yaml-file at https://www.openinfosecfoundation.org/rules/index.yaml. This vulnerability appears to have been fixed in 1.0.0b1.",9.3,CRITICAL,2018-04-18T19:29:00.833,CWE-502,"OISF suricata-update version 1.0.0a1 contains an Insecure Deserialization vulnerability in the insecure yaml.load-Function as used in the following files: config.py:136, config.py:142, sources.py:99 and sources.py:131. The ""list-sources""-command is affected by this bug. that can result in Remote Code Execution(even as root if suricata-update is called by root). This attack appears to be exploitable via a specially crafted yaml-file at URL This vulnerability appears to have been fixed in 1.0.0b1.",{'version': ['1.0.0']},"['oisf', 'suricata-update', 'version', '1.0.0a1', 'contains', 'an', 'insecure', 'deserialization', 'vulnerability', 'in', 'the', 'insecure', 'yaml.load-function', 'as', 'used', 'in', 'the', 'following', 'files', 'config.py:136', 'config.py:142', 'sources.py:99', 'and', 'sources.py:131.', 'the', '``', 'list-sources', ""''"", '-command', 'is', 'affected', 'by', 'this', 'bug', 'that', 'can', 'result', 'in', 'remote', 'code', 'execution', 'even', 'as', 'root', 'if', 'suricata-update', 'is', 'called', 'by', 'root', 'this', 'attack', 'appears', 'to', 'be', 'exploitable', 'via', 'specially', 'crafted', 'yaml-file', 'at', 'url', 'this', 'vulnerability', 'appears', 'to', 'have', 'been', 'fixed', 'in', '1.0.0b1']",71,"['OISF suricata-update version 1.0.0a1 contains an Insecure Deserialization vulnerability in the insecure yaml.load-Function as used in the following files: config.py:136, config.py:142, sources.py:99 and sources.py:131.', 'The ""list-sources""-command is affected by this bug.', 'that can result in Remote Code Execution(even as root if suricata-update is called by root).', 'This attack appears to be exploitable via a specially crafted yaml-file at URL This vulnerability appears to have been fixed in 1.0.0b1.']",4
CVE-2018-3784,A code injection in cryo 0.0.6 allows an attacker to arbitrarily execute code due to insecure implementation of deserialization.,9.8,CRITICAL,2018-08-17T13:29:00.407,"CWE-94, CWE-94, CWE-502",A code injection in cryo 0.0.6 allows an attacker to arbitrarily execute code due to insecure implementation of deserialization.,{'version': ['0.0.6']},"['code', 'injection', 'in', 'cryo', '0.0.6', 'allows', 'an', 'attacker', 'to', 'arbitrarily', 'execute', 'code', 'due', 'to', 'insecure', 'implementation', 'of', 'deserialization']",18,['A code injection in cryo 0.0.6 allows an attacker to arbitrarily execute code due to insecure implementation of deserialization.'],1
CVE-2018-15691,"Insecure deserialization of a specially crafted serialized object, in CA Release Automation 6.5 and earlier, allows attackers to potentially execute arbitrary code.",7.5,HIGH,2018-08-30T14:29:01.737,CWE-502,"Insecure deserialization of a specially crafted serialized object, in CA Release Automation 6.5 and earlier, allows attackers to potentially execute arbitrary code.",{'version': ['6.5']},"['insecure', 'deserialization', 'of', 'specially', 'crafted', 'serialized', 'object', 'in', 'ca', 'release', 'automation', '6.5', 'and', 'earlier', 'allows', 'attackers', 'to', 'potentially', 'execute', 'arbitrary', 'code']",21,"['Insecure deserialization of a specially crafted serialized object, in CA Release Automation 6.5 and earlier, allows attackers to potentially execute arbitrary code.']",1
CVE-2018-15381,"A Java deserialization vulnerability in Cisco Unity Express (CUE) could allow an unauthenticated, remote attacker to execute arbitrary shell commands with the privileges of the root user. The vulnerability is due to insecure deserialization of user-supplied content by the affected software. An attacker could exploit this vulnerability by sending a malicious serialized Java object to the listening Java Remote Method Invocation (RMI) service. A successful exploit could allow the attacker to execute arbitrary commands on the device with root privileges.",10.0,CRITICAL,2018-11-08T16:29:00.277,"CWE-502, CWE-502","A Java deserialization vulnerability in Cisco Unity Express (CUE) could allow an unauthenticated, remote attacker to execute arbitrary shell commands with the privileges of the root user. The vulnerability is due to insecure deserialization of user-supplied content by the affected software. An attacker could exploit this vulnerability by sending a malicious serialized Java object to the listening Java Remote Method Invocation (RMI) service. A successful exploit could allow the attacker to execute arbitrary commands on the device with root privileges.",{},"['java', 'deserialization', 'vulnerability', 'in', 'cisco', 'unity', 'express', 'cue', 'could', 'allow', 'an', 'unauthenticated', 'remote', 'attacker', 'to', 'execute', 'arbitrary', 'shell', 'commands', 'with', 'the', 'privileges', 'of', 'the', 'root', 'user', 'the', 'vulnerability', 'is', 'due', 'to', 'insecure', 'deserialization', 'of', 'user-supplied', 'content', 'by', 'the', 'affected', 'software', 'an', 'attacker', 'could', 'exploit', 'this', 'vulnerability', 'by', 'sending', 'malicious', 'serialized', 'java', 'object', 'to', 'the', 'listening', 'java', 'remote', 'method', 'invocation', 'rmi', 'service', 'successful', 'exploit', 'could', 'allow', 'the', 'attacker', 'to', 'execute', 'arbitrary', 'commands', 'on', 'the', 'device', 'with', 'root', 'privileges']",77,"['A Java deserialization vulnerability in Cisco Unity Express (CUE) could allow an unauthenticated, remote attacker to execute arbitrary shell commands with the privileges of the root user.', 'The vulnerability is due to insecure deserialization of user-supplied content by the affected software.', 'An attacker could exploit this vulnerability by sending a malicious serialized Java object to the listening Java Remote Method Invocation (RMI) service.', 'A successful exploit could allow the attacker to execute arbitrary commands on the device with root privileges.']",4
CVE-2018-19276,OpenMRS before 2.24.0 is affected by an Insecure Object Deserialization vulnerability that allows an unauthenticated user to execute arbitrary commands on the targeted system via crafted XML data in a request body.,9.8,CRITICAL,2019-03-21T16:00:30.390,CWE-502,OpenMRS before 2.24.0 is affected by an Insecure Object Deserialization vulnerability that allows an unauthenticated user to execute arbitrary commands on the targeted system via crafted XML data in a request body.,{'version': ['2.24.0']},"['openmrs', 'before', '2.24.0', 'is', 'affected', 'by', 'an', 'insecure', 'object', 'deserialization', 'vulnerability', 'that', 'allows', 'an', 'unauthenticated', 'user', 'to', 'execute', 'arbitrary', 'commands', 'on', 'the', 'targeted', 'system', 'via', 'crafted', 'xml', 'data', 'in', 'request', 'body']",31,['OpenMRS before 2.24.0 is affected by an Insecure Object Deserialization vulnerability that allows an unauthenticated user to execute arbitrary commands on the targeted system via crafted XML data in a request body.'],1
CVE-2019-12240,"The Virim plugin 0.4 for WordPress allows Insecure Deserialization via s_values, t_values, or c_values in graph.php.",7.5,HIGH,2019-05-20T20:29:00.783,CWE-502,"The Virim plugin 0.4 for WordPress allows Insecure Deserialization via s_values, t_values, or c_values in graph.php.",{'version': ['0.4']},"['the', 'virim', 'plugin', '0.4', 'for', 'wordpress', 'allows', 'insecure', 'deserialization', 'via', 's_values', 't_values', 'or', 'c_values', 'in', 'graph.php']",16,"['The Virim plugin 0.4 for WordPress allows Insecure Deserialization via s_values, t_values, or c_values in graph.php.']",1
CVE-2019-12241,The Carts Guru plugin 1.4.5 for WordPress allows Insecure Deserialization via a cartsguru-source cookie to classes/wc-cartsguru-event-handler.php.,7.5,HIGH,2019-05-20T20:29:00.847,CWE-502,The Carts Guru plugin 1.4.5 for WordPress allows Insecure Deserialization via a cartsguru-source cookie to classes/wc-cartsguru-event-handler.php.,{'version': ['1.4.5']},"['the', 'carts', 'guru', 'plugin', '1.4.5', 'for', 'wordpress', 'allows', 'insecure', 'deserialization', 'via', 'cartsguru-source', 'cookie', 'to', 'classes/wc-cartsguru-event-handler.php']",15,['The Carts Guru plugin 1.4.5 for WordPress allows Insecure Deserialization via a cartsguru-source cookie to classes/wc-cartsguru-event-handler.php.'],1
CVE-2019-6980,Synacor Zimbra Collaboration Suite 8.7.x through 8.8.11 allows insecure object deserialization in the IMAP component.,7.5,HIGH,2019-05-29T22:29:01.413,CWE-502,Synacor Zimbra Collaboration Suite 8.7.x through 8.8.11 allows insecure object deserialization in the IMAP component.,"{'version': ['8.7.', '8.8.11']}","['synacor', 'zimbra', 'collaboration', 'suite', '8.7.x', 'through', '8.8.11', 'allows', 'insecure', 'object', 'deserialization', 'in', 'the', 'imap', 'component']",15,['Synacor Zimbra Collaboration Suite 8.7.x through 8.8.11 allows insecure object deserialization in the IMAP component.'],1
CVE-2019-11030,"Mirasys VMS before V7.6.1 and 8.x before V8.3.2 mishandles the Mirasys.Common.Utils.Security.DataCrypt method in Common.dll in AuditTrailService in SMServer.exe. This method triggers insecure deserialization within the .NET garbage collector, in which a gadget (contained in a serialized object) may be executed with SYSTEM privileges. The attacker must properly encrypt the object; however, the hardcoded keys are available.",10.0,CRITICAL,2019-08-22T15:15:12.233,"CWE-502, CWE-798","Mirasys VMS before V7.6.1 and 8.x before V8.3.2 mishandles the Mirasys.Common.Utils.Security.DataCrypt method in Common.dll in AuditTrailService in SMServer.exe. This method triggers insecure deserialization within the .NET garbage collector, in which a gadget (contained in a serialized object) may be executed with SYSTEM privileges. The attacker must properly encrypt the object; however, the hardcoded keys are available.","{'version': ['V7.6.1', 'V8.3.2']}","['mirasys', 'vms', 'before', 'v7.6.1', 'and', '8.x', 'before', 'v8.3.2', 'mishandles', 'the', 'mirasys.common.utils.security.datacrypt', 'method', 'in', 'common.dll', 'in', 'audittrailservice', 'in', 'smserver.exe', 'this', 'method', 'triggers', 'insecure', 'deserialization', 'within', 'the', '.net', 'garbage', 'collector', 'in', 'which', 'gadget', 'contained', 'in', 'serialized', 'object', 'may', 'be', 'executed', 'with', 'system', 'privileges', 'the', 'attacker', 'must', 'properly', 'encrypt', 'the', 'object', 'however', 'the', 'hardcoded', 'keys', 'are', 'available']",54,"['Mirasys VMS before V7.6.1 and 8.x before V8.3.2 mishandles the Mirasys.Common.Utils.Security.DataCrypt method in Common.dll in AuditTrailService in SMServer.exe.', 'This method triggers insecure deserialization within the .NET garbage collector, in which a gadget (contained in a serialized object) may be executed with SYSTEM privileges.', 'The attacker must properly encrypt the object; however, the hardcoded keys are available.']",3
