cve_id,description,cvss_score,severity,published_date,cwe_ids,cleaned_description,extracted_entities,tokens,token_count,sentences,sentence_count
CVE-2000-1233,SQL injection vulnerability in read.php3 and other scripts in Phorum 3.0.7 allows remote attackers to execute arbitrary SQL queries via the sSQL parameter.,7.5,HIGH,2000-12-31T05:00:00.000,Unknown,SQL injection vulnerability in read.php3 and other scripts in Phorum 3.0.7 allows remote attackers to execute arbitrary SQL queries via the sSQL parameter.,{'version': ['3.0.7']},"['sql', 'injection', 'vulnerability', 'in', 'read.php3', 'and', 'other', 'scripts', 'in', 'phorum', '3.0.7', 'allows', 'remote', 'attackers', 'to', 'execute', 'arbitrary', 'sql', 'queries', 'via', 'the', 'ssql', 'parameter']",23,['SQL injection vulnerability in read.php3 and other scripts in Phorum 3.0.7 allows remote attackers to execute arbitrary SQL queries via the sSQL parameter.'],1
CVE-2000-1236,SQL injection vulnerability in mod_sql in Oracle Internet Application Server (IAS) 3.0.7 and earlier allows remote attackers to execute arbitrary SQL commands via the query string of the URL.,7.5,HIGH,2000-12-31T05:00:00.000,Unknown,SQL injection vulnerability in mod_sql in Oracle Internet Application Server (IAS) 3.0.7 and earlier allows remote attackers to execute arbitrary SQL commands via the query string of the URL.,{'version': ['3.0.7']},"['sql', 'injection', 'vulnerability', 'in', 'mod_sql', 'in', 'oracle', 'internet', 'application', 'server', 'ias', '3.0.7', 'and', 'earlier', 'allows', 'remote', 'attackers', 'to', 'execute', 'arbitrary', 'sql', 'commands', 'via', 'the', 'query', 'string', 'of', 'the', 'url']",29,['SQL injection vulnerability in mod_sql in Oracle Internet Application Server (IAS) 3.0.7 and earlier allows remote attackers to execute arbitrary SQL commands via the query string of the URL.'],1
CVE-2001-1348,TWIG 2.6.2 and earlier allows remote attackers to perform unauthorized database operations via a SQL injection attack on the id parameter.,7.5,HIGH,2001-05-28T04:00:00.000,Unknown,TWIG 2.6.2 and earlier allows remote attackers to perform unauthorized database operations via a SQL injection attack on the id parameter.,{'version': ['2.6.2']},"['twig', '2.6.2', 'and', 'earlier', 'allows', 'remote', 'attackers', 'to', 'perform', 'unauthorized', 'database', 'operations', 'via', 'sql', 'injection', 'attack', 'on', 'the', 'id', 'parameter']",20,['TWIG 2.6.2 and earlier allows remote attackers to perform unauthorized database operations via a SQL injection attack on the id parameter.'],1
CVE-2001-1472,SQL injection vulnerability in prefs.php in phpBB 1.4.0 and 1.4.1 allows remote authenticated users to execute arbitrary SQL commands and gain administrative access via the viewemail parameter.,4.6,MEDIUM,2001-08-03T04:00:00.000,Unknown,SQL injection vulnerability in prefs.php in phpBB 1.4.0 and 1.4.1 allows remote authenticated users to execute arbitrary SQL commands and gain administrative access via the viewemail parameter.,"{'version': ['1.4.0', '1.4.1']}","['sql', 'injection', 'vulnerability', 'in', 'prefs.php', 'in', 'phpbb', '1.4.0', 'and', '1.4.1', 'allows', 'remote', 'authenticated', 'users', 'to', 'execute', 'arbitrary', 'sql', 'commands', 'and', 'gain', 'administrative', 'access', 'via', 'the', 'viewemail', 'parameter']",27,['SQL injection vulnerability in prefs.php in phpBB 1.4.0 and 1.4.1 allows remote authenticated users to execute arbitrary SQL commands and gain administrative access via the viewemail parameter.'],1
CVE-2001-1379,"The PostgreSQL authentication modules (1) mod_auth_pgsql 0.9.5, and (2) mod_auth_pgsql_sys 0.9.4, allow remote attackers to bypass authentication and execute arbitrary SQL via a SQL injection attack on the user name.",7.5,HIGH,2001-08-29T04:00:00.000,Unknown,"The PostgreSQL authentication modules (1) mod_auth_pgsql 0.9.5, and (2) mod_auth_pgsql_sys 0.9.4, allow remote attackers to bypass authentication and execute arbitrary SQL via a SQL injection attack on the user name.","{'version': ['0.9.5', '0.9.4']}","['the', 'postgresql', 'authentication', 'modules', 'mod_auth_pgsql', '0.9.5', 'and', 'mod_auth_pgsql_sys', '0.9.4', 'allow', 'remote', 'attackers', 'to', 'bypass', 'authentication', 'and', 'execute', 'arbitrary', 'sql', 'via', 'sql', 'injection', 'attack', 'on', 'the', 'user', 'name']",27,"['The PostgreSQL authentication modules (1) mod_auth_pgsql 0.9.5, and (2) mod_auth_pgsql_sys 0.9.4, allow remote attackers to bypass authentication and execute arbitrary SQL via a SQL injection attack on the user name.']",1
CVE-2001-1402,"Bugzilla before 2.14 does not properly escape untrusted parameters, which could allow remote attackers to conduct unauthorized activities via cross-site scripting (CSS) and possibly SQL injection attacks on (1) the product or output form variables for reports.cgi, (2) the voteon, bug_id, and user variables for showvotes.cgi, (3) an invalid email address in createaccount.cgi, (4) an invalid ID in showdependencytree.cgi, (5) invalid usernames and other fields in process_bug.cgi, and (6) error messages in buglist.cgi.",7.5,HIGH,2001-09-10T04:00:00.000,Unknown,"Bugzilla before 2.14 does not properly escape untrusted parameters, which could allow remote attackers to conduct unauthorized activities via cross-site scripting (CSS) and possibly SQL injection attacks on (1) the product or output form variables for reports.cgi, (2) the voteon, bug_id, and user variables for showvotes.cgi, (3) an invalid email address in createaccount.cgi, (4) an invalid ID in showdependencytree.cgi, (5) invalid usernames and other fields in process_bug.cgi, and (6) error messages in buglist.cgi.",{'version': ['2.14']},"['bugzilla', 'before', '2.14', 'does', 'not', 'properly', 'escape', 'untrusted', 'parameters', 'which', 'could', 'allow', 'remote', 'attackers', 'to', 'conduct', 'unauthorized', 'activities', 'via', 'cross-site', 'scripting', 'css', 'and', 'possibly', 'sql', 'injection', 'attacks', 'on', 'the', 'product', 'or', 'output', 'form', 'variables', 'for', 'reports.cgi', 'the', 'voteon', 'bug_id', 'and', 'user', 'variables', 'for', 'showvotes.cgi', 'an', 'invalid', 'email', 'address', 'in', 'createaccount.cgi', 'an', 'invalid', 'id', 'in', 'showdependencytree.cgi', 'invalid', 'usernames', 'and', 'other', 'fields', 'in', 'process_bug.cgi', 'and', 'error', 'messages', 'in', 'buglist.cgi']",67,"['Bugzilla before 2.14 does not properly escape untrusted parameters, which could allow remote attackers to conduct unauthorized activities via cross-site scripting (CSS) and possibly SQL injection attacks on (1) the product or output form variables for reports.cgi, (2) the voteon, bug_id, and user variables for showvotes.cgi, (3) an invalid email address in createaccount.cgi, (4) an invalid ID in showdependencytree.cgi, (5) invalid usernames and other fields in process_bug.cgi, and (6) error messages in buglist.cgi.']",1
CVE-2001-1460,SQL injection vulnerability in article.php in PostNuke 0.62 through 0.64 allows remote attackers to bypass authentication via the user parameter.,7.5,HIGH,2001-10-13T04:00:00.000,Unknown,SQL injection vulnerability in article.php in PostNuke 0.62 through 0.64 allows remote attackers to bypass authentication via the user parameter.,"{'version': ['0.62', '0.64']}","['sql', 'injection', 'vulnerability', 'in', 'article.php', 'in', 'postnuke', '0.62', 'through', '0.64', 'allows', 'remote', 'attackers', 'to', 'bypass', 'authentication', 'via', 'the', 'user', 'parameter']",20,['SQL injection vulnerability in article.php in PostNuke 0.62 through 0.64 allows remote attackers to bypass authentication via the user parameter.'],1
CVE-2001-1224,get_input in adrotate.pm for Les VanBrunt AdRotate Pro 2.0 allows remote attackers to modify the database and possibly execute arbitrary commands via a SQL code injection attack.,7.5,HIGH,2001-12-23T05:00:00.000,Unknown,get_input in adrotate.pm for Les VanBrunt AdRotate Pro 2.0 allows remote attackers to modify the database and possibly execute arbitrary commands via a SQL code injection attack.,{'version': ['2.0']},"['get_input', 'in', 'adrotate.pm', 'for', 'les', 'vanbrunt', 'adrotate', 'pro', '2.0', 'allows', 'remote', 'attackers', 'to', 'modify', 'the', 'database', 'and', 'possibly', 'execute', 'arbitrary', 'commands', 'via', 'sql', 'code', 'injection', 'attack']",26,['get_input in adrotate.pm for Les VanBrunt AdRotate Pro 2.0 allows remote attackers to modify the database and possibly execute arbitrary commands via a SQL code injection attack.'],1
CVE-2001-1482,SQL injection vulnerability in bb_memberlist.php for phpBB 1.4.2 allows remote attackers to execute arbitrary SQL queries via the $sortby variable.,7.5,HIGH,2001-12-31T05:00:00.000,Unknown,SQL injection vulnerability in bb_memberlist.php for phpBB 1.4.2 allows remote attackers to execute arbitrary SQL queries via the $sortby variable.,{'version': ['1.4.2']},"['sql', 'injection', 'vulnerability', 'in', 'bb_memberlist.php', 'for', 'phpbb', '1.4.2', 'allows', 'remote', 'attackers', 'to', 'execute', 'arbitrary', 'sql', 'queries', 'via', 'the', 'sortby', 'variable']",20,['SQL injection vulnerability in bb_memberlist.php for phpBB 1.4.2 allows remote attackers to execute arbitrary SQL queries via the $sortby variable.'],1
CVE-2002-0216,"userinfo.php in XOOPS 1.0 RC1 allows remote attackers to obtain sensitive information via a SQL injection attack in the ""uid"" parameter.",5.0,MEDIUM,2002-05-16T04:00:00.000,Unknown,"userinfo.php in XOOPS 1.0 RC1 allows remote attackers to obtain sensitive information via a SQL injection attack in the ""uid"" parameter.",{'version': ['1.0']},"['userinfo.php', 'in', 'xoops', '1.0', 'rc1', 'allows', 'remote', 'attackers', 'to', 'obtain', 'sensitive', 'information', 'via', 'sql', 'injection', 'attack', 'in', 'the', '``', 'uid', ""''"", 'parameter']",22,"['userinfo.php in XOOPS 1.0 RC1 allows remote attackers to obtain sensitive information via a SQL injection attack in the ""uid"" parameter.']",1
CVE-2002-0287,"pforum 1.14 and earlier does not explicitly enable PHP magic quotes, which allows remote attackers to bypass authentication and gain administrator privileges via an SQL injection attack when the PHP server is not configured to use magic quotes by default.",10.0,CRITICAL,2002-05-31T04:00:00.000,Unknown,"pforum 1.14 and earlier does not explicitly enable PHP magic quotes, which allows remote attackers to bypass authentication and gain administrator privileges via an SQL injection attack when the PHP server is not configured to use magic quotes by default.",{'version': ['1.14']},"['pforum', '1.14', 'and', 'earlier', 'does', 'not', 'explicitly', 'enable', 'php', 'magic', 'quotes', 'which', 'allows', 'remote', 'attackers', 'to', 'bypass', 'authentication', 'and', 'gain', 'administrator', 'privileges', 'via', 'an', 'sql', 'injection', 'attack', 'when', 'the', 'php', 'server', 'is', 'not', 'configured', 'to', 'use', 'magic', 'quotes', 'by', 'default']",40,"['pforum 1.14 and earlier does not explicitly enable PHP magic quotes, which allows remote attackers to bypass authentication and gain administrator privileges via an SQL injection attack when the PHP server is not configured to use magic quotes by default.']",1
CVE-2002-0308,admin.asp in AdMentor 2.11 allows remote attackers to bypass authentication and gain privileges via a SQL injection attack on the Login and Password arguments.,10.0,CRITICAL,2002-05-31T04:00:00.000,Unknown,admin.asp in AdMentor 2.11 allows remote attackers to bypass authentication and gain privileges via a SQL injection attack on the Login and Password arguments.,{'version': ['2.11']},"['admin.asp', 'in', 'admentor', '2.11', 'allows', 'remote', 'attackers', 'to', 'bypass', 'authentication', 'and', 'gain', 'privileges', 'via', 'sql', 'injection', 'attack', 'on', 'the', 'login', 'and', 'password', 'arguments']",23,['admin.asp in AdMentor 2.11 allows remote attackers to bypass authentication and gain privileges via a SQL injection attack on the Login and Password arguments.'],1
CVE-2002-0607,"members.asp in Snitz Forums 2000 version 3.3.03 and earlier allows remote attackers to execute arbitrary code via a SQL injection attack on the parameters (1) M_NAME, (2) UserName, (3) FirstName, (4) LastName, or (5) INITIAL.",7.5,HIGH,2002-06-18T04:00:00.000,Unknown,"members.asp in Snitz Forums 2000 version 3.3.03 and earlier allows remote attackers to execute arbitrary code via a SQL injection attack on the parameters (1) M_NAME, (2) UserName, (3) FirstName, (4) LastName, or (5) INITIAL.",{'version': ['3.3.03']},"['members.asp', 'in', 'snitz', 'forums', '2000', 'version', '3.3.03', 'and', 'earlier', 'allows', 'remote', 'attackers', 'to', 'execute', 'arbitrary', 'code', 'via', 'sql', 'injection', 'attack', 'on', 'the', 'parameters', 'm_name', 'username', 'firstname', 'lastname', 'or', 'initial']",29,"['members.asp in Snitz Forums 2000 version 3.3.03 and earlier allows remote attackers to execute arbitrary code via a SQL injection attack on the parameters (1) M_NAME, (2) UserName, (3) FirstName, (4) LastName, or (5) INITIAL.']",1
CVE-2002-0187,"Cross-site scripting vulnerability in the SQLXML component of Microsoft SQL Server 2000 allows an attacker to execute arbitrary script via the root parameter as part of an XML SQL query, aka ""Script Injection via XML Tag.""",7.5,HIGH,2002-07-03T04:00:00.000,Unknown,"Cross-site scripting vulnerability in the SQLXML component of Microsoft SQL Server 2000 allows an attacker to execute arbitrary script via the root parameter as part of an XML SQL query, aka ""Script Injection via XML Tag.""",{},"['cross-site', 'scripting', 'vulnerability', 'in', 'the', 'sqlxml', 'component', 'of', 'microsoft', 'sql', 'server', '2000', 'allows', 'an', 'attacker', 'to', 'execute', 'arbitrary', 'script', 'via', 'the', 'root', 'parameter', 'as', 'part', 'of', 'an', 'xml', 'sql', 'query', 'aka', '``', 'script', 'injection', 'via', 'xml', 'tag', ""''""]",38,"['Cross-site scripting vulnerability in the SQLXML component of Microsoft SQL Server 2000 allows an attacker to execute arbitrary script via the root parameter as part of an XML SQL query, aka ""Script Injection via XML Tag.""']",1
CVE-2002-0536,"PHPGroupware 0.9.12 and earlier, when running with the magic_quotes_gpc feature disabled, allows remote attackers to compromise the database via a SQL injection attack.",7.5,HIGH,2002-07-03T04:00:00.000,Unknown,"PHPGroupware 0.9.12 and earlier, when running with the magic_quotes_gpc feature disabled, allows remote attackers to compromise the database via a SQL injection attack.",{'version': ['0.9.12']},"['phpgroupware', '0.9.12', 'and', 'earlier', 'when', 'running', 'with', 'the', 'magic_quotes_gpc', 'feature', 'disabled', 'allows', 'remote', 'attackers', 'to', 'compromise', 'the', 'database', 'via', 'sql', 'injection', 'attack']",22,"['PHPGroupware 0.9.12 and earlier, when running with the magic_quotes_gpc feature disabled, allows remote attackers to compromise the database via a SQL injection attack.']",1
CVE-2002-0539,Demarc PureSecure 1.05 allows remote attackers to gain administrative privileges via a SQL injection attack in a session ID that is stored in the s_key cookie.,10.0,CRITICAL,2002-07-03T04:00:00.000,Unknown,Demarc PureSecure 1.05 allows remote attackers to gain administrative privileges via a SQL injection attack in a session ID that is stored in the s_key cookie.,{'version': ['1.05']},"['demarc', 'puresecure', '1.05', 'allows', 'remote', 'attackers', 'to', 'gain', 'administrative', 'privileges', 'via', 'sql', 'injection', 'attack', 'in', 'session', 'id', 'that', 'is', 'stored', 'in', 'the', 's_key', 'cookie']",24,['Demarc PureSecure 1.05 allows remote attackers to gain administrative privileges via a SQL injection attack in a session ID that is stored in the s_key cookie.'],1
CVE-2002-0554,webdriver in IBM Informix Web DataBlade 4.12 allows remote attackers to bypass user access levels or read arbitrary files via a SQL injection attack in an HTTP request.,7.5,HIGH,2002-07-03T04:00:00.000,Unknown,webdriver in IBM Informix Web DataBlade 4.12 allows remote attackers to bypass user access levels or read arbitrary files via a SQL injection attack in an HTTP request.,{'version': ['4.12']},"['webdriver', 'in', 'ibm', 'informix', 'web', 'datablade', '4.12', 'allows', 'remote', 'attackers', 'to', 'bypass', 'user', 'access', 'levels', 'or', 'read', 'arbitrary', 'files', 'via', 'sql', 'injection', 'attack', 'in', 'an', 'http', 'request']",27,['webdriver in IBM Informix Web DataBlade 4.12 allows remote attackers to bypass user access levels or read arbitrary files via a SQL injection attack in an HTTP request.'],1
CVE-2002-0645,SQL injection vulnerability in stored procedures for Microsoft SQL Server 2000 and Microsoft Desktop Engine (MSDE) 2000 may allow authenticated users to execute arbitrary commands.,7.5,HIGH,2002-08-12T04:00:00.000,Unknown,SQL injection vulnerability in stored procedures for Microsoft SQL Server 2000 and Microsoft Desktop Engine (MSDE) 2000 may allow authenticated users to execute arbitrary commands.,{},"['sql', 'injection', 'vulnerability', 'in', 'stored', 'procedures', 'for', 'microsoft', 'sql', 'server', '2000', 'and', 'microsoft', 'desktop', 'engine', 'msde', '2000', 'may', 'allow', 'authenticated', 'users', 'to', 'execute', 'arbitrary', 'commands']",25,['SQL injection vulnerability in stored procedures for Microsoft SQL Server 2000 and Microsoft Desktop Engine (MSDE) 2000 may allow authenticated users to execute arbitrary commands.'],1
CVE-2002-0719,SQL injection vulnerability in the function that services for Microsoft Content Management Server (MCMS) 2001 allows remote attackers to execute arbitrary commands via an MCMS resource request for image files or other files.,7.5,HIGH,2002-08-12T04:00:00.000,Unknown,SQL injection vulnerability in the function that services for Microsoft Content Management Server (MCMS) 2001 allows remote attackers to execute arbitrary commands via an MCMS resource request for image files or other files.,{},"['sql', 'injection', 'vulnerability', 'in', 'the', 'function', 'that', 'services', 'for', 'microsoft', 'content', 'management', 'server', 'mcms', '2001', 'allows', 'remote', 'attackers', 'to', 'execute', 'arbitrary', 'commands', 'via', 'an', 'mcms', 'resource', 'request', 'for', 'image', 'files', 'or', 'other', 'files']",33,['SQL injection vulnerability in the function that services for Microsoft Content Management Server (MCMS) 2001 allows remote attackers to execute arbitrary commands via an MCMS resource request for image files or other files.'],1
CVE-2002-0802,"The multibyte support in PostgreSQL 6.5.x with SQL_ASCII encoding consumes an extra character when processing a character that cannot be converted, which could remove an escape character from the query and make the application subject to SQL injection attacks.",7.5,HIGH,2002-08-12T04:00:00.000,Unknown,"The multibyte support in PostgreSQL 6.5.x with SQL_ASCII encoding consumes an extra character when processing a character that cannot be converted, which could remove an escape character from the query and make the application subject to SQL injection attacks.",{'version': ['6.5.']},"['the', 'multibyte', 'support', 'in', 'postgresql', '6.5.x', 'with', 'sql_ascii', 'encoding', 'consumes', 'an', 'extra', 'character', 'when', 'processing', 'character', 'that', 'can', 'not', 'be', 'converted', 'which', 'could', 'remove', 'an', 'escape', 'character', 'from', 'the', 'query', 'and', 'make', 'the', 'application', 'subject', 'to', 'sql', 'injection', 'attacks']",39,"['The multibyte support in PostgreSQL 6.5.x with SQL_ASCII encoding consumes an extra character when processing a character that cannot be converted, which could remove an escape character from the query and make the application subject to SQL injection attacks.']",1
CVE-2002-0811,"Bugzilla 2.14 before 2.14.2, and 2.16 before 2.16rc2, may allow remote attackers to cause a denial of service or execute certain queries via a SQL injection attack on the sort order parameter to buglist.cgi.",7.5,HIGH,2002-08-12T04:00:00.000,Unknown,"Bugzilla 2.14 before 2.14.2, and 2.16 before 2.16rc2, may allow remote attackers to cause a denial of service or execute certain queries via a SQL injection attack on the sort order parameter to buglist.cgi.","{'version': ['2.14', '2.14.2', '2.16']}","['bugzilla', '2.14', 'before', '2.14.2', 'and', '2.16', 'before', '2.16rc2', 'may', 'allow', 'remote', 'attackers', 'to', 'cause', 'denial', 'of', 'service', 'or', 'execute', 'certain', 'queries', 'via', 'sql', 'injection', 'attack', 'on', 'the', 'sort', 'order', 'parameter', 'to', 'buglist.cgi']",32,"['Bugzilla 2.14 before 2.14.2, and 2.16 before 2.16rc2, may allow remote attackers to cause a denial of service or execute certain queries via a SQL injection attack on the sort order parameter to buglist.cgi.']",1
CVE-2002-0878,"SQL injection vulnerability in the login form for LogiSense software including (1) Hawk-i Billing, (2) Hawk-i ASP and (3) DNS Manager allows remote attackers to bypass authentication via SQL code in the password field.",7.5,HIGH,2002-10-04T04:00:00.000,Unknown,"SQL injection vulnerability in the login form for LogiSense software including (1) Hawk-i Billing, (2) Hawk-i ASP and (3) DNS Manager allows remote attackers to bypass authentication via SQL code in the password field.",{},"['sql', 'injection', 'vulnerability', 'in', 'the', 'login', 'form', 'for', 'logisense', 'software', 'including', 'hawk-i', 'billing', 'hawk-i', 'asp', 'and', 'dns', 'manager', 'allows', 'remote', 'attackers', 'to', 'bypass', 'authentication', 'via', 'sql', 'code', 'in', 'the', 'password', 'field']",31,"['SQL injection vulnerability in the login form for LogiSense software including (1) Hawk-i Billing, (2) Hawk-i ASP and (3) DNS Manager allows remote attackers to bypass authentication via SQL code in the password field.']",1
CVE-2002-0932,"SQL injection vulnerability in index.php for MyHelpDesk 20020509, and possibly other versions, allows remote attackers to conduct unauthorized activities via SQL code in the ""id"" parameter for the operations (1) detailticket, (2) editticket, or (3) updateticketlog.",6.4,MEDIUM,2002-10-04T04:00:00.000,Unknown,"SQL injection vulnerability in index.php for MyHelpDesk 20020509, and possibly other versions, allows remote attackers to conduct unauthorized activities via SQL code in the ""id"" parameter for the operations (1) detailticket, (2) editticket, or (3) updateticketlog.",{},"['sql', 'injection', 'vulnerability', 'in', 'index.php', 'for', 'myhelpdesk', '20020509', 'and', 'possibly', 'other', 'versions', 'allows', 'remote', 'attackers', 'to', 'conduct', 'unauthorized', 'activities', 'via', 'sql', 'code', 'in', 'the', '``', 'id', ""''"", 'parameter', 'for', 'the', 'operations', 'detailticket', 'editticket', 'or', 'updateticketlog']",35,"['SQL injection vulnerability in index.php for MyHelpDesk 20020509, and possibly other versions, allows remote attackers to conduct unauthorized activities via SQL code in the ""id"" parameter for the operations (1) detailticket, (2) editticket, or (3) updateticketlog.']",1
CVE-2002-0951,"SQL injection vulnerability in Ruslan <Body>Builder allows remote attackers to gain administrative privileges via a ""'--"" sequence in the username and password.",10.0,CRITICAL,2002-10-04T04:00:00.000,Unknown,"SQL injection vulnerability in Ruslan Builder allows remote attackers to gain administrative privileges via a ""'--"" sequence in the username and password.",{},"['sql', 'injection', 'vulnerability', 'in', 'ruslan', 'builder', 'allows', 'remote', 'attackers', 'to', 'gain', 'administrative', 'privileges', 'via', '``', '--', ""''"", 'sequence', 'in', 'the', 'username', 'and', 'password']",23,"['SQL injection vulnerability in Ruslan Builder allows remote attackers to gain administrative privileges via a ""\'--"" sequence in the username and password.']",1
CVE-2002-0961,"Vulnerabilities in Voxel Dot Net CBMS 0.7 and earlier allow remote attackers to conduct unauthorized operations as other users, e.g. by deleting clients via dltclnt.php, possibly in a SQL injection attack.",7.5,HIGH,2002-10-04T04:00:00.000,Unknown,"Vulnerabilities in Voxel Dot Net CBMS 0.7 and earlier allow remote attackers to conduct unauthorized operations as other users, e.g. by deleting clients via dltclnt.php, possibly in a SQL injection attack.",{'version': ['0.7']},"['vulnerabilities', 'in', 'voxel', 'dot', 'net', 'cbms', '0.7', 'and', 'earlier', 'allow', 'remote', 'attackers', 'to', 'conduct', 'unauthorized', 'operations', 'as', 'other', 'users', 'e.g', 'by', 'deleting', 'clients', 'via', 'dltclnt.php', 'possibly', 'in', 'sql', 'injection', 'attack']",30,"['Vulnerabilities in Voxel Dot Net CBMS 0.7 and earlier allow remote attackers to conduct unauthorized operations as other users, e.g.', 'by deleting clients via dltclnt.php, possibly in a SQL injection attack.']",2
