cve_id,description,cvss_score,severity,published_date,cwe_ids,cleaned_description,extracted_entities,tokens,token_count,sentences,sentence_count
CVE-2001-0537,"HTTP server for Cisco IOS 11.3 to 12.2 allows attackers to bypass authentication and execute arbitrary commands, when local authorization is being used, by specifying a high access level in the URL.",9.3,CRITICAL,2001-07-21T04:00:00.000,CWE-287,"HTTP server for Cisco IOS 11.3 to 12.2 allows attackers to bypass authentication and execute arbitrary commands, when local authorization is being used, by specifying a high access level in the URL.","{'version': ['11.3', '12.2']}","['http', 'server', 'for', 'cisco', 'ios', '11.3', 'to', '12.2', 'allows', 'attackers', 'to', 'bypass', 'authentication', 'and', 'execute', 'arbitrary', 'commands', 'when', 'local', 'authorization', 'is', 'being', 'used', 'by', 'specifying', 'high', 'access', 'level', 'in', 'the', 'url']",31,"['HTTP server for Cisco IOS 11.3 to 12.2 allows attackers to bypass authentication and execute arbitrary commands, when local authorization is being used, by specifying a high access level in the URL.']",1
CVE-1999-1177,Directory traversal vulnerability in nph-publish before 1.2 allows remote attackers to overwrite arbitrary files via a .. (dot dot) in the pathname for an upload operation.,5.0,MEDIUM,1999-12-31T05:00:00.000,Unknown,Directory traversal vulnerability in nph-publish before 1.2 allows remote attackers to overwrite arbitrary files via a .. (dot dot) in the pathname for an upload operation.,{'version': ['1.2']},"['directory', 'traversal', 'vulnerability', 'in', 'nph-publish', 'before', '1.2', 'allows', 'remote', 'attackers', 'to', 'overwrite', 'arbitrary', 'files', 'via', '..', 'dot', 'dot', 'in', 'the', 'pathname', 'for', 'an', 'upload', 'operation']",25,['Directory traversal vulnerability in nph-publish before 1.2 allows remote attackers to overwrite arbitrary files via a .. (dot dot) in the pathname for an upload operation.'],1
CVE-2001-0205,"Directory traversal vulnerability in AOLserver 3.2 and earlier allows remote attackers to read arbitrary files by inserting ""..."" into the requested pathname, a modified .. (dot dot) attack.",5.0,MEDIUM,2001-05-03T04:00:00.000,Unknown,"Directory traversal vulnerability in AOLserver 3.2 and earlier allows remote attackers to read arbitrary files by inserting ""..."" into the requested pathname, a modified .. (dot dot) attack.",{'version': ['3.2']},"['directory', 'traversal', 'vulnerability', 'in', 'aolserver', '3.2', 'and', 'earlier', 'allows', 'remote', 'attackers', 'to', 'read', 'arbitrary', 'files', 'by', 'inserting', '``', '...', ""''"", 'into', 'the', 'requested', 'pathname', 'modified', '..', 'dot', 'dot', 'attack']",29,"['Directory traversal vulnerability in AOLserver 3.2 and earlier allows remote attackers to read arbitrary files by inserting ""..."" into the requested pathname, a modified .. (dot dot) attack.']",1
CVE-2001-0206,Directory traversal vulnerability in Soft Lite ServerWorx 3.00 allows remote attackers to read arbitrary files by inserting a .. (dot dot) or ... into the requested pathname of an HTTP GET request.,5.0,MEDIUM,2001-06-02T04:00:00.000,Unknown,Directory traversal vulnerability in Soft Lite ServerWorx 3.00 allows remote attackers to read arbitrary files by inserting a .. (dot dot) or ... into the requested pathname of an HTTP GET request.,{'version': ['3.00']},"['directory', 'traversal', 'vulnerability', 'in', 'soft', 'lite', 'serverworx', '3.00', 'allows', 'remote', 'attackers', 'to', 'read', 'arbitrary', 'files', 'by', 'inserting', '..', 'dot', 'dot', 'or', '...', 'into', 'the', 'requested', 'pathname', 'of', 'an', 'http', 'get', 'request']",31,['Directory traversal vulnerability in Soft Lite ServerWorx 3.00 allows remote attackers to read arbitrary files by inserting a .. (dot dot) or ... into the requested pathname of an HTTP GET request.'],1
CVE-2002-0244,Directory traversal vulnerability in chroot function in AtheOS 0.3.7 allows attackers to escape the jail via a .. (dot dot) in the pathname argument to chdir.,7.5,HIGH,2002-05-29T04:00:00.000,Unknown,Directory traversal vulnerability in chroot function in AtheOS 0.3.7 allows attackers to escape the jail via a .. (dot dot) in the pathname argument to chdir.,{'version': ['0.3.7']},"['directory', 'traversal', 'vulnerability', 'in', 'chroot', 'function', 'in', 'atheos', '0.3.7', 'allows', 'attackers', 'to', 'escape', 'the', 'jail', 'via', '..', 'dot', 'dot', 'in', 'the', 'pathname', 'argument', 'to', 'chdir']",25,['Directory traversal vulnerability in chroot function in AtheOS 0.3.7 allows attackers to escape the jail via a .. (dot dot) in the pathname argument to chdir.'],1
CVE-2002-1525,"Directory traversal vulnerability in ASTAware SearchDisk engine for Sun ONE Starter Kit 2.0 allows remote attackers to read arbitrary files via a .. (dot dot) attack on port (1) 6015 or (2) 6016, or (3) an absolute pathname to port 6017.",5.0,MEDIUM,2003-04-02T05:00:00.000,Unknown,"Directory traversal vulnerability in ASTAware SearchDisk engine for Sun ONE Starter Kit 2.0 allows remote attackers to read arbitrary files via a .. (dot dot) attack on port (1) 6015 or (2) 6016, or (3) an absolute pathname to port 6017.",{'version': ['2.0']},"['directory', 'traversal', 'vulnerability', 'in', 'astaware', 'searchdisk', 'engine', 'for', 'sun', 'one', 'starter', 'kit', '2.0', 'allows', 'remote', 'attackers', 'to', 'read', 'arbitrary', 'files', 'via', '..', 'dot', 'dot', 'attack', 'on', 'port', '6015', 'or', '6016', 'or', 'an', 'absolute', 'pathname', 'to', 'port', '6017']",37,"['Directory traversal vulnerability in ASTAware SearchDisk engine for Sun ONE Starter Kit 2.0 allows remote attackers to read arbitrary files via a .. (dot dot) attack on port (1) 6015 or (2) 6016, or (3) an absolute pathname to port 6017.']",1
CVE-2003-1345,Directory traversal vulnerability in s.dll in WebCollection Plus 5.00 allows remote attackers to view arbitrary files in c:\ via a full pathname in the d parameter.,5.0,MEDIUM,2003-12-31T05:00:00.000,CWE-22,Directory traversal vulnerability in s.dll in WebCollection Plus 5.00 allows remote attackers to view arbitrary files in c:\ via a full pathname in the d parameter.,{'version': ['5.00']},"['directory', 'traversal', 'vulnerability', 'in', 's.dll', 'in', 'webcollection', 'plus', '5.00', 'allows', 'remote', 'attackers', 'to', 'view', 'arbitrary', 'files', 'in', 'c', 'via', 'full', 'pathname', 'in', 'the', 'parameter']",24,['Directory traversal vulnerability in s.dll in WebCollection Plus 5.00 allows remote attackers to view arbitrary files in c:\\ via a full pathname in the d parameter.'],1
CVE-2003-1463,"Absolute path traversal vulnerability in Alt-N Technologies WebAdmin 2.0.0 through 2.0.2 allows remote attackers with administrator privileges to (1) determine the installation path by reading the contents of the Name parameter in a link, and (2) read arbitrary files via an absolute path in the Name parameter.",3.5,LOW,2003-12-31T05:00:00.000,CWE-20,"Absolute path traversal vulnerability in Alt-N Technologies WebAdmin 2.0.0 through 2.0.2 allows remote attackers with administrator privileges to (1) determine the installation path by reading the contents of the Name parameter in a link, and (2) read arbitrary files via an absolute path in the Name parameter.","{'version': ['2.0.0', '2.0.2']}","['absolute', 'path', 'traversal', 'vulnerability', 'in', 'alt-n', 'technologies', 'webadmin', '2.0.0', 'through', '2.0.2', 'allows', 'remote', 'attackers', 'with', 'administrator', 'privileges', 'to', 'determine', 'the', 'installation', 'path', 'by', 'reading', 'the', 'contents', 'of', 'the', 'name', 'parameter', 'in', 'link', 'and', 'read', 'arbitrary', 'files', 'via', 'an', 'absolute', 'path', 'in', 'the', 'name', 'parameter']",44,"['Absolute path traversal vulnerability in Alt-N Technologies WebAdmin 2.0.0 through 2.0.2 allows remote attackers with administrator privileges to (1) determine the installation path by reading the contents of the Name parameter in a link, and (2) read arbitrary files via an absolute path in the Name parameter.']",1
CVE-2003-1545,"Absolute path traversal vulnerability in nukestyles.com viewpage.php addon for PHP-Nuke allows remote attackers to read arbitrary files via a full pathname in the file parameter.  NOTE: This was originally reported as an issue in PHP-Nuke 6.5, but this is an independent addon.",5.0,MEDIUM,2003-12-31T05:00:00.000,CWE-22,"Absolute path traversal vulnerability in nukestyles.com viewpage.php addon for PHP-Nuke allows remote attackers to read arbitrary files via a full pathname in the file parameter. NOTE: This was originally reported as an issue in PHP-Nuke 6.5, but this is an independent addon.",{'version': ['6.5']},"['absolute', 'path', 'traversal', 'vulnerability', 'in', 'nukestyles.com', 'viewpage.php', 'addon', 'for', 'php-nuke', 'allows', 'remote', 'attackers', 'to', 'read', 'arbitrary', 'files', 'via', 'full', 'pathname', 'in', 'the', 'file', 'parameter', 'note', 'this', 'was', 'originally', 'reported', 'as', 'an', 'issue', 'in', 'php-nuke', '6.5', 'but', 'this', 'is', 'an', 'independent', 'addon']",41,"['Absolute path traversal vulnerability in nukestyles.com viewpage.php addon for PHP-Nuke allows remote attackers to read arbitrary files via a full pathname in the file parameter.', 'NOTE: This was originally reported as an issue in PHP-Nuke 6.5, but this is an independent addon.']",2
CVE-2004-2047,Directory traversal vulnerability in EasyWeb FileManager 1.0 RC-1 for PostNuke allows remote attackers to retrieve arbitrary files via a .. (dot dot) in the pathext parameter.,5.0,MEDIUM,2004-07-23T04:00:00.000,Unknown,Directory traversal vulnerability in EasyWeb FileManager 1.0 RC-1 for PostNuke allows remote attackers to retrieve arbitrary files via a .. (dot dot) in the pathext parameter.,{'version': ['1.0']},"['directory', 'traversal', 'vulnerability', 'in', 'easyweb', 'filemanager', '1.0', 'rc-1', 'for', 'postnuke', 'allows', 'remote', 'attackers', 'to', 'retrieve', 'arbitrary', 'files', 'via', '..', 'dot', 'dot', 'in', 'the', 'pathext', 'parameter']",25,['Directory traversal vulnerability in EasyWeb FileManager 1.0 RC-1 for PostNuke allows remote attackers to retrieve arbitrary files via a .. (dot dot) in the pathext parameter.'],1
CVE-2004-0235,"Multiple directory traversal vulnerabilities in LHA 1.14 allow remote attackers or local users to create arbitrary files via an LHA archive containing filenames with (1) .. sequences or (2) absolute pathnames with double leading slashes (""//absolute/path"").",6.4,MEDIUM,2004-08-18T04:00:00.000,Unknown,"Multiple directory traversal vulnerabilities in LHA 1.14 allow remote attackers or local users to create arbitrary files via an LHA archive containing filenames with (1) .. sequences or (2) absolute pathnames with double leading slashes (""//absolute/path"").",{'version': ['1.14']},"['multiple', 'directory', 'traversal', 'vulnerabilities', 'in', 'lha', '1.14', 'allow', 'remote', 'attackers', 'or', 'local', 'users', 'to', 'create', 'arbitrary', 'files', 'via', 'an', 'lha', 'archive', 'containing', 'filenames', 'with', '..', 'sequences', 'or', 'absolute', 'pathnames', 'with', 'double', 'leading', 'slashes', '``', '//absolute/path', ""''""]",36,"['Multiple directory traversal vulnerabilities in LHA 1.14 allow remote attackers or local users to create arbitrary files via an LHA archive containing filenames with (1) .. sequences or (2) absolute pathnames with double leading slashes (""//absolute/path"").']",1
CVE-2004-0237,Directory traversal vulnerability in index.php in Aprox PHP Portal allows remote attackers to read arbitrary files via a full pathname in the show parameter.,5.0,MEDIUM,2004-11-23T05:00:00.000,Unknown,Directory traversal vulnerability in index.php in Aprox PHP Portal allows remote attackers to read arbitrary files via a full pathname in the show parameter.,{},"['directory', 'traversal', 'vulnerability', 'in', 'index.php', 'in', 'aprox', 'php', 'portal', 'allows', 'remote', 'attackers', 'to', 'read', 'arbitrary', 'files', 'via', 'full', 'pathname', 'in', 'the', 'show', 'parameter']",23,['Directory traversal vulnerability in index.php in Aprox PHP Portal allows remote attackers to read arbitrary files via a full pathname in the show parameter.'],1
CVE-2004-1543,Directory traversal vulnerability in viewimg.php in KorWeblog 1.6.2-cvs and earlier allows remote attackers to list arbitrary directories via a .. (dot dot) in the path parameter.,5.0,MEDIUM,2004-12-31T05:00:00.000,Unknown,Directory traversal vulnerability in viewimg.php in KorWeblog 1.6.2-cvs and earlier allows remote attackers to list arbitrary directories via a .. (dot dot) in the path parameter.,{'version': ['1.6.2']},"['directory', 'traversal', 'vulnerability', 'in', 'viewimg.php', 'in', 'korweblog', '1.6.2-cvs', 'and', 'earlier', 'allows', 'remote', 'attackers', 'to', 'list', 'arbitrary', 'directories', 'via', '..', 'dot', 'dot', 'in', 'the', 'path', 'parameter']",25,['Directory traversal vulnerability in viewimg.php in KorWeblog 1.6.2-cvs and earlier allows remote attackers to list arbitrary directories via a .. (dot dot) in the path parameter.'],1
CVE-2004-2507,Absolute path traversal vulnerability in main.cgi in Linksys WVC11B Wireless-B Internet Video Camera allows remote attackers to read arbitrary files via an absolute pathname in the next_file parameter.,5.0,MEDIUM,2004-12-31T05:00:00.000,Unknown,Absolute path traversal vulnerability in main.cgi in Linksys WVC11B Wireless-B Internet Video Camera allows remote attackers to read arbitrary files via an absolute pathname in the next_file parameter.,{},"['absolute', 'path', 'traversal', 'vulnerability', 'in', 'main.cgi', 'in', 'linksys', 'wvc11b', 'wireless-b', 'internet', 'video', 'camera', 'allows', 'remote', 'attackers', 'to', 'read', 'arbitrary', 'files', 'via', 'an', 'absolute', 'pathname', 'in', 'the', 'next_file', 'parameter']",28,['Absolute path traversal vulnerability in main.cgi in Linksys WVC11B Wireless-B Internet Video Camera allows remote attackers to read arbitrary files via an absolute pathname in the next_file parameter.'],1
CVE-2004-2565,"Multiple directory traversal vulnerabilities in Sambar Server 6.1 Beta 2 on Windows, and possibly other versions on Linux, when the administrative IP address restrictions have been modified from the default, allow remote authenticated users to read arbitrary files via (1) a ""..\"" (dot dot backslash) in the file parameter to showini.asp, or (2) an absolute path with drive letter in the log parameter to showlog.asp.",5.0,MEDIUM,2004-12-31T05:00:00.000,Unknown,"Multiple directory traversal vulnerabilities in Sambar Server 6.1 Beta 2 on Windows, and possibly other versions on Linux, when the administrative IP address restrictions have been modified from the default, allow remote authenticated users to read arbitrary files via (1) a ""..\"" (dot dot backslash) in the file parameter to showini.asp, or (2) an absolute path with drive letter in the log parameter to showlog.asp.",{'version': ['6.1']},"['multiple', 'directory', 'traversal', 'vulnerabilities', 'in', 'sambar', 'server', '6.1', 'beta', 'on', 'windows', 'and', 'possibly', 'other', 'versions', 'on', 'linux', 'when', 'the', 'administrative', 'ip', 'address', 'restrictions', 'have', 'been', 'modified', 'from', 'the', 'default', 'allow', 'remote', 'authenticated', 'users', 'to', 'read', 'arbitrary', 'files', 'via', '``', '..', ""''"", 'dot', 'dot', 'backslash', 'in', 'the', 'file', 'parameter', 'to', 'showini.asp', 'or', 'an', 'absolute', 'path', 'with', 'drive', 'letter', 'in', 'the', 'log', 'parameter', 'to', 'showlog.asp']",63,"['Multiple directory traversal vulnerabilities in Sambar Server 6.1 Beta 2 on Windows, and possibly other versions on Linux, when the administrative IP address restrictions have been modified from the default, allow remote authenticated users to read arbitrary files via (1) a ""..\\"" (dot dot backslash) in the file parameter to showini.asp, or (2) an absolute path with drive letter in the log parameter to showlog.asp.']",1
CVE-2004-2594,"Absolute path traversal vulnerability in Quake II server before R1Q2 on Windows, as used in multiple products, allows remote attackers to read arbitrary files via a ""\/"" in a pathname argument, as demonstrated by ""download \/server.cfg"".",5.0,MEDIUM,2004-12-31T05:00:00.000,Unknown,"Absolute path traversal vulnerability in Quake II server before R1Q2 on Windows, as used in multiple products, allows remote attackers to read arbitrary files via a ""\/"" in a pathname argument, as demonstrated by ""download \/server.cfg"".",{},"['absolute', 'path', 'traversal', 'vulnerability', 'in', 'quake', 'ii', 'server', 'before', 'r1q2', 'on', 'windows', 'as', 'used', 'in', 'multiple', 'products', 'allows', 'remote', 'attackers', 'to', 'read', 'arbitrary', 'files', 'via', '``', '\\/', ""''"", 'in', 'pathname', 'argument', 'as', 'demonstrated', 'by', '``', 'download', '\\/server.cfg', ""''""]",38,"['Absolute path traversal vulnerability in Quake II server before R1Q2 on Windows, as used in multiple products, allows remote attackers to read arbitrary files via a ""\\/"" in a pathname argument, as demonstrated by ""download \\/server.cfg"".']",1
CVE-2004-2595,"Absolute path traversal vulnerability in Quake II server before R1Q2 on Linux, as used in multiple products, allows remote attackers to cause a denial of service (application crash) via a download command with a full pathname for a directory in the argument, which causes the server to crash when it cannot read data.",5.0,MEDIUM,2004-12-31T05:00:00.000,Unknown,"Absolute path traversal vulnerability in Quake II server before R1Q2 on Linux, as used in multiple products, allows remote attackers to cause a denial of service (application crash) via a download command with a full pathname for a directory in the argument, which causes the server to crash when it cannot read data.",{},"['absolute', 'path', 'traversal', 'vulnerability', 'in', 'quake', 'ii', 'server', 'before', 'r1q2', 'on', 'linux', 'as', 'used', 'in', 'multiple', 'products', 'allows', 'remote', 'attackers', 'to', 'cause', 'denial', 'of', 'service', 'application', 'crash', 'via', 'download', 'command', 'with', 'full', 'pathname', 'for', 'directory', 'in', 'the', 'argument', 'which', 'causes', 'the', 'server', 'to', 'crash', 'when', 'it', 'can', 'not', 'read', 'data']",50,"['Absolute path traversal vulnerability in Quake II server before R1Q2 on Linux, as used in multiple products, allows remote attackers to cause a denial of service (application crash) via a download command with a full pathname for a directory in the argument, which causes the server to crash when it cannot read data.']",1
CVE-2004-2640,Directory traversal vulnerability in lstat.cgi in LinuxStat before 2.3.1 allows remote attackers to read arbitrary files via (1) .. (dot dot) sequences or (2) absolute paths to the template parameter.,5.0,MEDIUM,2004-12-31T05:00:00.000,Unknown,Directory traversal vulnerability in lstat.cgi in LinuxStat before 2.3.1 allows remote attackers to read arbitrary files via (1) .. (dot dot) sequences or (2) absolute paths to the template parameter.,{'version': ['2.3.1']},"['directory', 'traversal', 'vulnerability', 'in', 'lstat.cgi', 'in', 'linuxstat', 'before', '2.3.1', 'allows', 'remote', 'attackers', 'to', 'read', 'arbitrary', 'files', 'via', '..', 'dot', 'dot', 'sequences', 'or', 'absolute', 'paths', 'to', 'the', 'template', 'parameter']",28,['Directory traversal vulnerability in lstat.cgi in LinuxStat before 2.3.1 allows remote attackers to read arbitrary files via (1) .. (dot dot) sequences or (2) absolute paths to the template parameter.'],1
CVE-2005-0161,Multiple directory traversal vulnerabilities in unace 1.2b allow attackers to overwrite arbitrary files via an ACE archive containing (1) ../ sequences or (2) absolute pathnames.,2.1,LOW,2005-02-22T05:00:00.000,Unknown,Multiple directory traversal vulnerabilities in unace 1.2b allow attackers to overwrite arbitrary files via an ACE archive containing (1) ../ sequences or (2) absolute pathnames.,{'version': ['1.2']},"['multiple', 'directory', 'traversal', 'vulnerabilities', 'in', 'unace', '1.2b', 'allow', 'attackers', 'to', 'overwrite', 'arbitrary', 'files', 'via', 'an', 'ace', 'archive', 'containing', '..', 'sequences', 'or', 'absolute', 'pathnames']",23,['Multiple directory traversal vulnerabilities in unace 1.2b allow attackers to overwrite arbitrary files via an ACE archive containing (1) ../ sequences or (2) absolute pathnames.'],1
CVE-2005-0801,Directory traversal vulnerability in includer.cgi in The Includer allows remote attackers to read arbitrary files via (1) a .. (dot dot) or (2) a full pathname in the URL.,5.0,MEDIUM,2005-05-02T04:00:00.000,Unknown,Directory traversal vulnerability in includer.cgi in The Includer allows remote attackers to read arbitrary files via (1) a .. (dot dot) or (2) a full pathname in the URL.,{},"['directory', 'traversal', 'vulnerability', 'in', 'includer.cgi', 'in', 'the', 'includer', 'allows', 'remote', 'attackers', 'to', 'read', 'arbitrary', 'files', 'via', '..', 'dot', 'dot', 'or', 'full', 'pathname', 'in', 'the', 'url']",25,['Directory traversal vulnerability in includer.cgi in The Includer allows remote attackers to read arbitrary files via (1) a .. (dot dot) or (2) a full pathname in the URL.'],1
CVE-2005-1896,Directory traversal vulnerability in thumb.php in FlatNuke 2.5.3 allows remote attackers to read arbitrary images or obtain the installation path via the image parameter.,5.0,MEDIUM,2005-06-09T04:00:00.000,Unknown,Directory traversal vulnerability in thumb.php in FlatNuke 2.5.3 allows remote attackers to read arbitrary images or obtain the installation path via the image parameter.,{'version': ['2.5.3']},"['directory', 'traversal', 'vulnerability', 'in', 'thumb.php', 'in', 'flatnuke', '2.5.3', 'allows', 'remote', 'attackers', 'to', 'read', 'arbitrary', 'images', 'or', 'obtain', 'the', 'installation', 'path', 'via', 'the', 'image', 'parameter']",24,['Directory traversal vulnerability in thumb.php in FlatNuke 2.5.3 allows remote attackers to read arbitrary images or obtain the installation path via the image parameter.'],1
CVE-2005-2053,"Just another flat file (JAF) CMS before 3.0 Final allows remote attackers to obtain sensitive information via (1) an * (asterisk) in the id parameter, (2) a blank id parameter, or (3) an * (asterisk) in the disp parameter to index.php, which reveals the path in an error message.  NOTE: a followup suggests that this may be a directory traversal or file inclusion vulnerability.",5.0,MEDIUM,2005-06-28T04:00:00.000,Unknown,"Just another flat file (JAF) CMS before 3.0 Final allows remote attackers to obtain sensitive information via (1) an * (asterisk) in the id parameter, (2) a blank id parameter, or (3) an * (asterisk) in the disp parameter to index.php, which reveals the path in an error message. NOTE: a followup suggests that this may be a directory traversal or file inclusion vulnerability.",{'version': ['3.0']},"['just', 'another', 'flat', 'file', 'jaf', 'cms', 'before', '3.0', 'final', 'allows', 'remote', 'attackers', 'to', 'obtain', 'sensitive', 'information', 'via', 'an', 'asterisk', 'in', 'the', 'id', 'parameter', 'blank', 'id', 'parameter', 'or', 'an', 'asterisk', 'in', 'the', 'disp', 'parameter', 'to', 'index.php', 'which', 'reveals', 'the', 'path', 'in', 'an', 'error', 'message', 'note', 'followup', 'suggests', 'that', 'this', 'may', 'be', 'directory', 'traversal', 'or', 'file', 'inclusion', 'vulnerability']",56,"['Just another flat file (JAF) CMS before 3.0 Final allows remote attackers to obtain sensitive information via (1) an * (asterisk) in the id parameter, (2) a blank id parameter, or (3) an * (asterisk) in the disp parameter to index.php, which reveals the path in an error message.', 'NOTE: a followup suggests that this may be a directory traversal or file inclusion vulnerability.']",2
CVE-2005-2255,"Directory traversal vulnerability in PhpAuction 2.5 allows remote attackers to read arbitrary files, include local PHP files, or obtain sensitive path information via ""..""  sequences in the lan parameter to (1) index.php or (2) admin/index.php.",6.4,MEDIUM,2005-07-13T04:00:00.000,Unknown,"Directory traversal vulnerability in PhpAuction 2.5 allows remote attackers to read arbitrary files, include local PHP files, or obtain sensitive path information via "".."" sequences in the lan parameter to (1) index.php or (2) admin/index.php.",{'version': ['2.5']},"['directory', 'traversal', 'vulnerability', 'in', 'phpauction', '2.5', 'allows', 'remote', 'attackers', 'to', 'read', 'arbitrary', 'files', 'include', 'local', 'php', 'files', 'or', 'obtain', 'sensitive', 'path', 'information', 'via', '``', '..', ""''"", 'sequences', 'in', 'the', 'lan', 'parameter', 'to', 'index.php', 'or', 'admin/index.php']",35,"['Directory traversal vulnerability in PhpAuction 2.5 allows remote attackers to read arbitrary files, include local PHP files, or obtain sensitive path information via "".."" sequences in the lan parameter to (1) index.php or (2) admin/index.php.']",1
