cve_id,description,cvss_score,severity,published_date,cwe_ids,cleaned_description,extracted_entities,tokens,token_count,sentences,sentence_count
CVE-2006-2495,Cross-site request forgery (CSRF) vulnerability in the Entry Manager in Serendipity before 1.0-beta3 allows remote attackers to perform unauthorized actions as a logged-in user via a link or IMG tag.,7.5,HIGH,2006-05-20T03:02:00.000,Unknown,Cross-site request forgery (CSRF) vulnerability in the Entry Manager in Serendipity before 1.0-beta3 allows remote attackers to perform unauthorized actions as a logged-in user via a link or IMG tag.,{'version': ['1.0']},"['cross-site', 'request', 'forgery', 'csrf', 'vulnerability', 'in', 'the', 'entry', 'manager', 'in', 'serendipity', 'before', '1.0-beta3', 'allows', 'remote', 'attackers', 'to', 'perform', 'unauthorized', 'actions', 'as', 'logged-in', 'user', 'via', 'link', 'or', 'img', 'tag']",28,['Cross-site request forgery (CSRF) vulnerability in the Entry Manager in Serendipity before 1.0-beta3 allows remote attackers to perform unauthorized actions as a logged-in user via a link or IMG tag.'],1
CVE-2006-3272,"Cross-site request forgery (CSRF) vulnerability in menu.php in Some Chess 1.5 rc2 allows remote attackers to conduct actions as another user, such as changing usernames and passwords, via unspecified vectors.  NOTE: the provenance of this information is unknown; the details are obtained from third party information.",5.0,MEDIUM,2006-06-28T22:05:00.000,Unknown,"Cross-site request forgery (CSRF) vulnerability in menu.php in Some Chess 1.5 rc2 allows remote attackers to conduct actions as another user, such as changing usernames and passwords, via unspecified vectors. NOTE: the provenance of this information is unknown; the details are obtained from third party information.",{'version': ['1.5']},"['cross-site', 'request', 'forgery', 'csrf', 'vulnerability', 'in', 'menu.php', 'in', 'some', 'chess', '1.5', 'rc2', 'allows', 'remote', 'attackers', 'to', 'conduct', 'actions', 'as', 'another', 'user', 'such', 'as', 'changing', 'usernames', 'and', 'passwords', 'via', 'unspecified', 'vectors', 'note', 'the', 'provenance', 'of', 'this', 'information', 'is', 'unknown', 'the', 'details', 'are', 'obtained', 'from', 'third', 'party', 'information']",46,"['Cross-site request forgery (CSRF) vulnerability in menu.php in Some Chess 1.5 rc2 allows remote attackers to conduct actions as another user, such as changing usernames and passwords, via unspecified vectors.', 'NOTE: the provenance of this information is unknown; the details are obtained from third party information.']",2
CVE-2006-3420,Cross-site request forgery (CSRF) vulnerability in editpost.php in MyBulletinBoard (MyBB) before 1.1.5 allows remote attackers to perform unauthorized actions as a logged in user and delete arbitrary forum posts via a bbcode IMG tag with a modified delete parameter in a deletepost action.  NOTE: the provenance of this information is unknown; the details are obtained solely from third party information.,7.5,HIGH,2006-07-07T00:05:00.000,Unknown,Cross-site request forgery (CSRF) vulnerability in editpost.php in MyBulletinBoard (MyBB) before 1.1.5 allows remote attackers to perform unauthorized actions as a logged in user and delete arbitrary forum posts via a bbcode IMG tag with a modified delete parameter in a deletepost action. NOTE: the provenance of this information is unknown; the details are obtained solely from third party information.,{'version': ['1.1.5']},"['cross-site', 'request', 'forgery', 'csrf', 'vulnerability', 'in', 'editpost.php', 'in', 'mybulletinboard', 'mybb', 'before', '1.1.5', 'allows', 'remote', 'attackers', 'to', 'perform', 'unauthorized', 'actions', 'as', 'logged', 'in', 'user', 'and', 'delete', 'arbitrary', 'forum', 'posts', 'via', 'bbcode', 'img', 'tag', 'with', 'modified', 'delete', 'parameter', 'in', 'deletepost', 'action', 'note', 'the', 'provenance', 'of', 'this', 'information', 'is', 'unknown', 'the', 'details', 'are', 'obtained', 'solely', 'from', 'third', 'party', 'information']",56,"['Cross-site request forgery (CSRF) vulnerability in editpost.php in MyBulletinBoard (MyBB) before 1.1.5 allows remote attackers to perform unauthorized actions as a logged in user and delete arbitrary forum posts via a bbcode IMG tag with a modified delete parameter in a deletepost action.', 'NOTE: the provenance of this information is unknown; the details are obtained solely from third party information.']",2
CVE-2006-3479,"Cross-site request forgery (CSRF) vulnerability in the del_block function in modules/Admin/block.php in Nuked-Klan 1.7.5 and earlier and 1.7 SP4.2 allows remote attackers to delete arbitrary ""blocks"" via a link with a modified bid parameter in a del_block op on the block page in index.php.",5.0,MEDIUM,2006-07-10T20:05:00.000,Unknown,"Cross-site request forgery (CSRF) vulnerability in the del_block function in modules/Admin/block.php in Nuked-Klan 1.7.5 and earlier and 1.7 SP4.2 allows remote attackers to delete arbitrary ""blocks"" via a link with a modified bid parameter in a del_block op on the block page in index.php.","{'version': ['1.7.5', '1.7', '4.2']}","['cross-site', 'request', 'forgery', 'csrf', 'vulnerability', 'in', 'the', 'del_block', 'function', 'in', 'modules/admin/block.php', 'in', 'nuked-klan', '1.7.5', 'and', 'earlier', 'and', '1.7', 'sp4.2', 'allows', 'remote', 'attackers', 'to', 'delete', 'arbitrary', '``', 'blocks', ""''"", 'via', 'link', 'with', 'modified', 'bid', 'parameter', 'in', 'del_block', 'op', 'on', 'the', 'block', 'page', 'in', 'index.php']",43,"['Cross-site request forgery (CSRF) vulnerability in the del_block function in modules/Admin/block.php in Nuked-Klan 1.7.5 and earlier and 1.7 SP4.2 allows remote attackers to delete arbitrary ""blocks"" via a link with a modified bid parameter in a del_block op on the block page in index.php.']",1
CVE-2006-3671,Cross-site request forgery (CSRF) vulnerability in the communicate function in estmaster.c for Hyper Estraier before 1.3.3 allows remote attackers to perform unauthorized actions as other users via unknown vectors.,7.5,HIGH,2006-07-18T15:47:00.000,Unknown,Cross-site request forgery (CSRF) vulnerability in the communicate function in estmaster.c for Hyper Estraier before 1.3.3 allows remote attackers to perform unauthorized actions as other users via unknown vectors.,{'version': ['1.3.3']},"['cross-site', 'request', 'forgery', 'csrf', 'vulnerability', 'in', 'the', 'communicate', 'function', 'in', 'estmaster.c', 'for', 'hyper', 'estraier', 'before', '1.3.3', 'allows', 'remote', 'attackers', 'to', 'perform', 'unauthorized', 'actions', 'as', 'other', 'users', 'via', 'unknown', 'vectors']",29,['Cross-site request forgery (CSRF) vulnerability in the communicate function in estmaster.c for Hyper Estraier before 1.3.3 allows remote attackers to perform unauthorized actions as other users via unknown vectors.'],1
CVE-2006-3829,Cross-site request forgery (CSRF) vulnerability in bmc/admin.php in Kailash Nadh boastMachine (formerly bMachine) 3.1 and earlier allows remote attackers to perform unauthorized actions as an administrator and delete arbitrary user accounts via a delete_user action.,5.0,MEDIUM,2006-07-25T13:22:00.000,Unknown,Cross-site request forgery (CSRF) vulnerability in bmc/admin.php in Kailash Nadh boastMachine (formerly bMachine) 3.1 and earlier allows remote attackers to perform unauthorized actions as an administrator and delete arbitrary user accounts via a delete_user action.,{'version': ['3.1']},"['cross-site', 'request', 'forgery', 'csrf', 'vulnerability', 'in', 'bmc/admin.php', 'in', 'kailash', 'nadh', 'boastmachine', 'formerly', 'bmachine', '3.1', 'and', 'earlier', 'allows', 'remote', 'attackers', 'to', 'perform', 'unauthorized', 'actions', 'as', 'an', 'administrator', 'and', 'delete', 'arbitrary', 'user', 'accounts', 'via', 'delete_user', 'action']",34,['Cross-site request forgery (CSRF) vulnerability in bmc/admin.php in Kailash Nadh boastMachine (formerly bMachine) 3.1 and earlier allows remote attackers to perform unauthorized actions as an administrator and delete arbitrary user accounts via a delete_user action.'],1
CVE-2006-4659,"The Panda Platinum Internet Security 2006 10.02.01 and 2007 11.00.00 uses predictable URLs for the spam classification of each message, which allows remote attackers to cause Panda to classify arbitrary messages as spam via a web page that contains IMG tags with the predictable URLs.  NOTE: this issue could also be regarded as a cross-site request forgery (CSRF) vulnerability.",5.0,MEDIUM,2006-09-09T00:04:00.000,Unknown,"The Panda Platinum Internet Security 2006 10.02.01 and 2007 11.00.00 uses predictable URLs for the spam classification of each message, which allows remote attackers to cause Panda to classify arbitrary messages as spam via a web page that contains IMG tags with the predictable URLs. NOTE: this issue could also be regarded as a cross-site request forgery (CSRF) vulnerability.","{'version': ['10.02.01', '11.00.00']}","['the', 'panda', 'platinum', 'internet', 'security', '2006', '10.02.01', 'and', '2007', '11.00.00', 'uses', 'predictable', 'urls', 'for', 'the', 'spam', 'classification', 'of', 'each', 'message', 'which', 'allows', 'remote', 'attackers', 'to', 'cause', 'panda', 'to', 'classify', 'arbitrary', 'messages', 'as', 'spam', 'via', 'web', 'page', 'that', 'contains', 'img', 'tags', 'with', 'the', 'predictable', 'urls', 'note', 'this', 'issue', 'could', 'also', 'be', 'regarded', 'as', 'cross-site', 'request', 'forgery', 'csrf', 'vulnerability']",57,"['The Panda Platinum Internet Security 2006 10.02.01 and 2007 11.00.00 uses predictable URLs for the spam classification of each message, which allows remote attackers to cause Panda to classify arbitrary messages as spam via a web page that contains IMG tags with the predictable URLs.', 'NOTE: this issue could also be regarded as a cross-site request forgery (CSRF) vulnerability.']",2
CVE-2006-5116,"Multiple cross-site request forgery (CSRF) vulnerabilities in phpMyAdmin before 2.9.1-rc1 allow remote attackers to perform unauthorized actions as another user by (1) directly setting a token in the URL though dynamic variable evaluation and (2) unsetting arbitrary variables via the _REQUEST array, related to (a) libraries/common.lib.php, (b) session.inc.php, and (c) url_generating.lib.php.  NOTE: the PHP unset function vector is covered by CVE-2006-3017.",5.1,MEDIUM,2006-10-03T04:03:00.000,Unknown,"Multiple cross-site request forgery (CSRF) vulnerabilities in phpMyAdmin before 2.9.1-rc1 allow remote attackers to perform unauthorized actions as another user by (1) directly setting a token in the URL though dynamic variable evaluation and (2) unsetting arbitrary variables via the _REQUEST array, related to (a) libraries/common.lib.php, (b) session.inc.php, and (c) url_generating.lib.php. NOTE: the PHP unset function vector is covered by CVE-2006-3017.","{'cve_id': ['CVE-2006-3017'], 'version': ['2.9.1']}","['multiple', 'cross-site', 'request', 'forgery', 'csrf', 'vulnerabilities', 'in', 'phpmyadmin', 'before', '2.9.1-rc1', 'allow', 'remote', 'attackers', 'to', 'perform', 'unauthorized', 'actions', 'as', 'another', 'user', 'by', 'directly', 'setting', 'token', 'in', 'the', 'url', 'though', 'dynamic', 'variable', 'evaluation', 'and', 'unsetting', 'arbitrary', 'variables', 'via', 'the', '_request', 'array', 'related', 'to', 'libraries/common.lib.php', 'session.inc.php', 'and', 'c', 'url_generating.lib.php', 'note', 'the', 'php', 'unset', 'function', 'vector', 'is', 'covered', 'by', 'cve-2006-3017']",56,"['Multiple cross-site request forgery (CSRF) vulnerabilities in phpMyAdmin before 2.9.1-rc1 allow remote attackers to perform unauthorized actions as another user by (1) directly setting a token in the URL though dynamic variable evaluation and (2) unsetting arbitrary variables via the _REQUEST array, related to (a) libraries/common.lib.php, (b) session.inc.php, and (c) url_generating.lib.php.', 'NOTE: the PHP unset function vector is covered by CVE-2006-3017.']",2
CVE-1999-0244,Livingston RADIUS code has a buffer overflow which can allow remote execution of commands as root.,7.5,HIGH,1997-12-01T05:00:00.000,Unknown,Livingston RADIUS code has a buffer overflow which can allow remote execution of commands as root.,{},"['livingston', 'radius', 'code', 'has', 'buffer', 'overflow', 'which', 'can', 'allow', 'remote', 'execution', 'of', 'commands', 'as', 'root']",15,['Livingston RADIUS code has a buffer overflow which can allow remote execution of commands as root.'],1
CVE-1999-0440,The byte code verifier component of the Java Virtual Machine (JVM) allows remote execution through malicious web pages.,7.5,HIGH,1999-03-01T05:00:00.000,Unknown,The byte code verifier component of the Java Virtual Machine (JVM) allows remote execution through malicious web pages.,{},"['the', 'byte', 'code', 'verifier', 'component', 'of', 'the', 'java', 'virtual', 'machine', 'jvm', 'allows', 'remote', 'execution', 'through', 'malicious', 'web', 'pages']",18,['The byte code verifier component of the Java Virtual Machine (JVM) allows remote execution through malicious web pages.'],1
CVE-2001-1283,"The webmail interface for Ipswitch IMail 7.04 and earlier allows remote authenticated users to cause a denial of service (crash) via a mailbox name that contains a large number of . (dot) or other characters to programs such as (1) readmail.cgi or (2) printmail.cgi, possibly due to a buffer overflow that may allow execution of arbitrary code.",7.5,HIGH,2001-10-12T04:00:00.000,Unknown,"The webmail interface for Ipswitch IMail 7.04 and earlier allows remote authenticated users to cause a denial of service (crash) via a mailbox name that contains a large number of . (dot) or other characters to programs such as (1) readmail.cgi or (2) printmail.cgi, possibly due to a buffer overflow that may allow execution of arbitrary code.",{'version': ['7.04']},"['the', 'webmail', 'interface', 'for', 'ipswitch', 'imail', '7.04', 'and', 'earlier', 'allows', 'remote', 'authenticated', 'users', 'to', 'cause', 'denial', 'of', 'service', 'crash', 'via', 'mailbox', 'name', 'that', 'contains', 'large', 'number', 'of', 'dot', 'or', 'other', 'characters', 'to', 'programs', 'such', 'as', 'readmail.cgi', 'or', 'printmail.cgi', 'possibly', 'due', 'to', 'buffer', 'overflow', 'that', 'may', 'allow', 'execution', 'of', 'arbitrary', 'code']",50,"['The webmail interface for Ipswitch IMail 7.04 and earlier allows remote authenticated users to cause a denial of service (crash) via a mailbox name that contains a large number of .', '(dot) or other characters to programs such as (1) readmail.cgi or (2) printmail.cgi, possibly due to a buffer overflow that may allow execution of arbitrary code.']",2
CVE-2001-0727,"Internet Explorer 6.0 allows remote attackers to execute arbitrary code by modifying the Content-Disposition and Content-Type header fields in a way that causes Internet Explorer to believe that the file is safe to open without prompting the user, aka the ""File Execution Vulnerability.""",7.5,HIGH,2001-12-14T05:00:00.000,Unknown,"Internet Explorer 6.0 allows remote attackers to execute arbitrary code by modifying the Content-Disposition and Content-Type header fields in a way that causes Internet Explorer to believe that the file is safe to open without prompting the user, aka the ""File Execution Vulnerability.""",{'version': ['6.0']},"['internet', 'explorer', '6.0', 'allows', 'remote', 'attackers', 'to', 'execute', 'arbitrary', 'code', 'by', 'modifying', 'the', 'content-disposition', 'and', 'content-type', 'header', 'fields', 'in', 'way', 'that', 'causes', 'internet', 'explorer', 'to', 'believe', 'that', 'the', 'file', 'is', 'safe', 'to', 'open', 'without', 'prompting', 'the', 'user', 'aka', 'the', '``', 'file', 'execution', 'vulnerability', ""''""]",44,"['Internet Explorer 6.0 allows remote attackers to execute arbitrary code by modifying the Content-Disposition and Content-Type header fields in a way that causes Internet Explorer to believe that the file is safe to open without prompting the user, aka the ""File Execution Vulnerability.""']",1
CVE-2002-0618,"The Macro Security Model in Microsoft Excel 2000 and 2002 for Windows allows remote attackers to execute code in the Local Computer zone by embedding HTML scripts within an Excel workbook that contains an XSL stylesheet, aka ""Excel XSL Stylesheet Script Execution"".",7.5,HIGH,2002-08-12T04:00:00.000,Unknown,"The Macro Security Model in Microsoft Excel 2000 and 2002 for Windows allows remote attackers to execute code in the Local Computer zone by embedding HTML scripts within an Excel workbook that contains an XSL stylesheet, aka ""Excel XSL Stylesheet Script Execution"".",{},"['the', 'macro', 'security', 'model', 'in', 'microsoft', 'excel', '2000', 'and', '2002', 'for', 'windows', 'allows', 'remote', 'attackers', 'to', 'execute', 'code', 'in', 'the', 'local', 'computer', 'zone', 'by', 'embedding', 'html', 'scripts', 'within', 'an', 'excel', 'workbook', 'that', 'contains', 'an', 'xsl', 'stylesheet', 'aka', '``', 'excel', 'xsl', 'stylesheet', 'script', 'execution', ""''""]",44,"['The Macro Security Model in Microsoft Excel 2000 and 2002 for Windows allows remote attackers to execute code in the Local Computer zone by embedding HTML scripts within an Excel workbook that contains an XSL stylesheet, aka ""Excel XSL Stylesheet Script Execution"".']",1
CVE-2002-0694,"The HTML Help facility in Microsoft Windows 98, 98 Second Edition, Millennium Edition, NT 4.0, NT 4.0 Terminal Server Edition, Windows 2000, and Windows XP uses the Local Computer Security Zone when opening .chm files from the Temporary Internet Files folder, which allows remote attackers to execute arbitrary code via HTML mail that references or inserts a malicious .chm file containing shortcuts that can be executed, aka ""Code Execution via Compiled HTML Help File.""",7.5,HIGH,2002-10-10T04:00:00.000,Unknown,"The HTML Help facility in Microsoft Windows 98, 98 Second Edition, Millennium Edition, NT 4.0, NT 4.0 Terminal Server Edition, Windows 2000, and Windows XP uses the Local Computer Security Zone when opening .chm files from the Temporary Internet Files folder, which allows remote attackers to execute arbitrary code via HTML mail that references or inserts a malicious .chm file containing shortcuts that can be executed, aka ""Code Execution via Compiled HTML Help File.""",{'version': ['4.0']},"['the', 'html', 'help', 'facility', 'in', 'microsoft', 'windows', '98', '98', 'second', 'edition', 'millennium', 'edition', 'nt', '4.0', 'nt', '4.0', 'terminal', 'server', 'edition', 'windows', '2000', 'and', 'windows', 'xp', 'uses', 'the', 'local', 'computer', 'security', 'zone', 'when', 'opening', '.chm', 'files', 'from', 'the', 'temporary', 'internet', 'files', 'folder', 'which', 'allows', 'remote', 'attackers', 'to', 'execute', 'arbitrary', 'code', 'via', 'html', 'mail', 'that', 'references', 'or', 'inserts', 'malicious', '.chm', 'file', 'containing', 'shortcuts', 'that', 'can', 'be', 'executed', 'aka', '``', 'code', 'execution', 'via', 'compiled', 'html', 'help', 'file', ""''""]",75,"['The HTML Help facility in Microsoft Windows 98, 98 Second Edition, Millennium Edition, NT 4.0, NT 4.0 Terminal Server Edition, Windows 2000, and Windows XP uses the Local Computer Security Zone when opening .chm files from the Temporary Internet Files folder, which allows remote attackers to execute arbitrary code via HTML mail that references or inserts a malicious .chm file containing shortcuts that can be executed, aka ""Code Execution via Compiled HTML Help File.""']",1
CVE-2002-1870,"Simple Web Server (SWS) 0.0.4 through 0.1.0 does not properly handle when the recv function call fails, which may allow remote attackers to overwrite program data or perform actions on an uninitialized heap, leading to a denial of service and possibly code execution.",7.5,HIGH,2002-12-31T05:00:00.000,Unknown,"Simple Web Server (SWS) 0.0.4 through 0.1.0 does not properly handle when the recv function call fails, which may allow remote attackers to overwrite program data or perform actions on an uninitialized heap, leading to a denial of service and possibly code execution.","{'version': ['0.0.4', '0.1.0']}","['simple', 'web', 'server', 'sws', '0.0.4', 'through', '0.1.0', 'does', 'not', 'properly', 'handle', 'when', 'the', 'recv', 'function', 'call', 'fails', 'which', 'may', 'allow', 'remote', 'attackers', 'to', 'overwrite', 'program', 'data', 'or', 'perform', 'actions', 'on', 'an', 'uninitialized', 'heap', 'leading', 'to', 'denial', 'of', 'service', 'and', 'possibly', 'code', 'execution']",42,"['Simple Web Server (SWS) 0.0.4 through 0.1.0 does not properly handle when the recv function call fails, which may allow remote attackers to overwrite program data or perform actions on an uninitialized heap, leading to a denial of service and possibly code execution.']",1
CVE-2003-1094,"BEA WebLogic Server and Express version 7.0 SP3 may follow certain code execution paths that result in an incorrect current user, such as in the frequent use of JNDI initial contexts, which could allow remote authenticated users to gain privileges.",7.2,HIGH,2003-12-31T05:00:00.000,Unknown,"BEA WebLogic Server and Express version 7.0 SP3 may follow certain code execution paths that result in an incorrect current user, such as in the frequent use of JNDI initial contexts, which could allow remote authenticated users to gain privileges.",{'version': ['7.0']},"['bea', 'weblogic', 'server', 'and', 'express', 'version', '7.0', 'sp3', 'may', 'follow', 'certain', 'code', 'execution', 'paths', 'that', 'result', 'in', 'an', 'incorrect', 'current', 'user', 'such', 'as', 'in', 'the', 'frequent', 'use', 'of', 'jndi', 'initial', 'contexts', 'which', 'could', 'allow', 'remote', 'authenticated', 'users', 'to', 'gain', 'privileges']",40,"['BEA WebLogic Server and Express version 7.0 SP3 may follow certain code execution paths that result in an incorrect current user, such as in the frequent use of JNDI initial contexts, which could allow remote authenticated users to gain privileges.']",1
CVE-2004-0594,"The memory_limit functionality in PHP 4.x up to 4.3.7, and 5.x up to 5.0.0RC3, under certain conditions such as when register_globals is enabled, allows remote attackers to execute arbitrary code by triggering a memory_limit abort during execution of the zend_hash_init function and overwriting a HashTable destructor pointer before the initialization of key data structures is complete.",5.1,MEDIUM,2004-07-27T04:00:00.000,CWE-367,"The memory_limit functionality in PHP 4.x up to 4.3.7, and 5.x up to 5.0.0RC3, under certain conditions such as when register_globals is enabled, allows remote attackers to execute arbitrary code by triggering a memory_limit abort during execution of the zend_hash_init function and overwriting a HashTable destructor pointer before the initialization of key data structures is complete.","{'version': ['4.3.7', '5.0.0']}","['the', 'memory_limit', 'functionality', 'in', 'php', '4.x', 'up', 'to', '4.3.7', 'and', '5.x', 'up', 'to', '5.0.0rc3', 'under', 'certain', 'conditions', 'such', 'as', 'when', 'register_globals', 'is', 'enabled', 'allows', 'remote', 'attackers', 'to', 'execute', 'arbitrary', 'code', 'by', 'triggering', 'memory_limit', 'abort', 'during', 'execution', 'of', 'the', 'zend_hash_init', 'function', 'and', 'overwriting', 'hashtable', 'destructor', 'pointer', 'before', 'the', 'initialization', 'of', 'key', 'data', 'structures', 'is', 'complete']",54,"['The memory_limit functionality in PHP 4.x up to 4.3.7, and 5.x up to 5.0.0RC3, under certain conditions such as when register_globals is enabled, allows remote attackers to execute arbitrary code by triggering a memory_limit abort during execution of the zend_hash_init function and overwriting a HashTable destructor pointer before the initialization of key data structures is complete.']",1
CVE-2004-2560,"DokuWiki before 2004-10-19, when used on a web server that permits execution based on file extension, allows remote attackers to execute arbitrary code by uploading a file with an appropriate extension such as "".php"" or "".cgi"".",7.5,HIGH,2004-12-31T05:00:00.000,Unknown,"DokuWiki before 2004-10-19, when used on a web server that permits execution based on file extension, allows remote attackers to execute arbitrary code by uploading a file with an appropriate extension such as "".php"" or "".cgi"".",{},"['dokuwiki', 'before', '2004-10-19', 'when', 'used', 'on', 'web', 'server', 'that', 'permits', 'execution', 'based', 'on', 'file', 'extension', 'allows', 'remote', 'attackers', 'to', 'execute', 'arbitrary', 'code', 'by', 'uploading', 'file', 'with', 'an', 'appropriate', 'extension', 'such', 'as', '``', '.php', ""''"", 'or', '``', '.cgi', ""''""]",38,"['DokuWiki before 2004-10-19, when used on a web server that permits execution based on file extension, allows remote attackers to execute arbitrary code by uploading a file with an appropriate extension such as "".php"" or "".cgi"".']",1
